created_at,text
2022-01-20 15:20:07,楽天圏でやってるから楽天証券がいいのかな？？、 #tama954
2022-01-20 15:20:05,仮想通貨は乱高下するからね #tama954
2022-01-20 15:19:59,基本のキみたいなことを言ってるけど、大事な話 #tama954
2022-01-20 15:19:59,余らねえ… #tama954
2022-01-20 15:19:57,#tama954　そうそう、余力で回さないと続かないよね。投資も株も。
2022-01-20 15:19:54,ひとりごと：投資信託でインデックスファンド、、、あとは手数料の勝負とφ(．．)？　 #tama954
2022-01-20 15:19:53,仮想通貨はギャンブルw #tama954
2022-01-20 15:19:50,どうでもいいけど、声がデケぇな… #tama954
2022-01-20 15:19:49,赤江さんが仮想通貨やったらえらい事になるだろうな #tama954
2022-01-20 15:19:44,出たw仮想通貨w #tama954
2022-01-20 15:19:43,401kを会社でやってるけど今年はなんか楽天証券とかやろっかなと思ってる楽天カード作って楽天経済圏にズブズブ入ってこうかなあと #tama954
2022-01-20 15:19:36,@tos赤江さんは紙で持っていたい派 #tama954
2022-01-20 15:19:33,さっきお金の話をダイエットに置き換えた礼央さんに乗っかり……ゲスト厚切りジェイソンさん「痩せたければ、我慢と努力」太りにくい生活の習慣化では？つまり余計な支出をしない・把握する生活の習慣化。 #tama954
2022-01-20 15:19:29,僕もちょっとずつちょっとずつやけど株を買い増しをしていってる #tama954
2022-01-20 15:19:29,その回だけ「もぐらの時代」でやって欲しい #tama954 https://t.co/VdiXitrlUM
2022-01-20 15:19:27,数撃ちゃ当たる感じなのか？ #tama954
2022-01-20 15:19:23,日本にその辺のシステムが根付いてないからねー #tama954
2022-01-20 15:19:23,で、ライフネット生命に入ればいいの？(´･∀･｀)(´ー｀)#tama954
2022-01-20 15:19:22,信頼できる投資信託に積み立てるのが一番ですよ。#tama954大江英樹さんに聞く「積立投資って、どう活用すればよいのでしょう？」 https://t.co/3lGtzQTbjv
2022-01-20 15:19:17,金の細工物を買ってはいけません #tama954
2022-01-20 15:19:13,ま、オッズは幾らで、テラ銭幾らで、幾ら突っ込むか。あとは税金で幾ら抜かれるか。そういう話なんではありますけどね#tama954 https://t.co/afopEiUf6x
2022-01-20 15:19:11,「絶対にプラスにならなきゃ嫌だ」って人は、今のところは金を買っとけばいいんでないの。しらんけど。 #tama954
2022-01-20 15:19:08,最終的にはGPIFが買い支えてくれる※ #tama954
2022-01-20 15:19:06,モーラ #tama954 https://t.co/6oJEO3UdtV
2022-01-20 15:19:05,元本保証の無いものに手は出せないな。#tama954
2022-01-20 15:19:04,投資信託は手数料の低いところはネット証券だよな… #tama954
2022-01-20 15:19:02,#tama954　資本主義っていうのかなコレ？
2022-01-20 15:19:00,インデックスファンドはまず手数料の安い所を選びましょうw #tama954
2022-01-20 15:18:58,ドルコスト平均法ってやつやね #tama954
2022-01-20 15:18:57,投資信託も沢山ありますけど自分はセゾン投信のグローバルバランスファンド買ってます #tama954
2022-01-20 15:18:48,#tama954　LINE証券とかもあるもんね。
2022-01-20 15:18:48,投信の中味は皆違うんじゃないのかな　 #tama954
2022-01-20 15:18:47,オンライン会議終了で『たまむすび』に復帰。じぇじぇこの話で盛り上がってる（笑） #tama954
2022-01-20 15:18:37,「魔法はない！」そうですね… #tama954
2022-01-20 15:18:33,わかった‼つみたてNISAやるっ‼w #tama954
2022-01-20 15:18:31,日本って貯金をすることが美徳化されてるわな #tama954
2022-01-20 15:18:24,生活水準は上げ下げもなくて、最低の生活水準があってそれに足りるか足りないかがほぼなのよ。そこを越える時が非常に少ないから安定した投資が出来ない。超えたとしても過去のマイナスの精算に回る。 #tama954
2022-01-20 15:18:16,（これ買えあれ買えって薦めるのは大丈夫なのかね？儲かると言ったらアウトなんだっけ？） #tama954
2022-01-20 15:18:16,ニーサ？ #tama954
2022-01-20 15:18:12,レオレオ、VR買うのは我慢だな#tama954
2022-01-20 15:18:11,広〜く浅〜く色んなモノを網羅したインデックス？   #tama954
2022-01-20 15:18:08,やはり岡野陽一との対立は避けられない厚切りジェイソン #tama954
2022-01-20 15:18:08,圧がすごい😅#tama954
2022-01-20 15:18:08,#tama954　やはり投信か。ドルコスト平均法とかか？
2022-01-20 15:18:04,何から始めたらいいんですか‼︎泣 #tama954
2022-01-20 15:17:58,インデックスファンドがまあ無難ですな #tama954
2022-01-20 15:17:58,インデックスファンドか… #tama954
2022-01-20 15:17:53,投信ね… #tama954
2022-01-20 15:17:45,ボクらの時代、かなんかでw#tama954 https://t.co/P8UJ1lM4xS
2022-01-20 15:17:41,ラジオの時はもう少し落ち着いたトーンで話して欲しいな 芸風はさておき貯金してない、って急に入り用になった時はどうするんだろ？投資信託解約するの？？ #tama954
2022-01-20 15:17:38,本当はね、どうせ株を買うんであれば、大好きな会社の株を買いたいんだよね。 #tama954
2022-01-20 15:17:36,その投信はどこで買えるの　 #tama954
2022-01-20 15:17:34,声が大きくて聞きつ続けるのは大変だけど、言ってることは本当そうだなって思う #tama954
2022-01-20 15:17:30,たしかに1円にしかならない貯金するなら、投資にまわしたほうがクレバーだな #tama954
2022-01-20 15:17:26,貯金をしないというのは海外の人らしい。日本人の貯金志向は信仰に近いからな #tama954
2022-01-20 15:17:20,投資の前に凍死しそう…… #tama954
2022-01-20 15:17:10,レオレオはビットコインとかやっていそうなイメージだけど　 #tama954
2022-01-20 15:17:06,レオレオ泣いちゃう😅 ｗ    #tama954
2022-01-20 15:17:06,我慢と努力… #tama954
2022-01-20 15:17:04,ある近接分野のメーカー2社の株をリーマンショックの時に買ってそのままにしているが、現在、当時の株価から見事に逆転してる(つまり、差し引き…w) #tama954
2022-01-20 15:16:58,ギャンブルは再現性が無いw #tama954
2022-01-20 15:16:49,TBSラジオは最近投資の普及に力をいれてるのかな？ #tama954
2022-01-20 15:16:45,一回投資信託をやったが、目減りして塩漬け状態だった、損切りするタイミングを逸した。 #tama954
2022-01-20 15:16:42,うう…すごい… #tama954
2022-01-20 15:16:25,厚切りジェイソン「去年株価25%上がったんですよ！でも銀行に預けているだけならたった7円ですよ。いらんわ！」 #tama954
2022-01-20 15:16:25,#tama954 投資して、お金に仕事してもらう。桐谷さんとかも投資凄いものね。
2022-01-20 15:16:18,定期預金も高金利のキャンペーンしてるネットバンクくらいしかほとんど意味ないよね #tama954
2022-01-20 15:16:15,投資とは言えるほどのことではないけど、外貨の口座作っていくらか入れておくと、日々世界とつながってる感が実感できます。　 #tama954
2022-01-20 15:16:13,誰か厚切りジェイソンと岡野陽一&amp;鈴木もぐらの対談をセッティングして！ #tama954
2022-01-20 15:16:10,#tama954 日本の格言。一円を笑う者は一円に泣く。
2022-01-20 15:15:55,生活費以外は全部投資にまわすの？ #tama954
2022-01-20 15:15:53,こちとら夫婦共働きで生活費と貯金、ローンでいっぱいいっぱいですわ　#tama954
2022-01-20 15:15:52,厚切りジェイソンさんの考え方、真に裕福の人の考え方だなぁ。収入に合わせて生活レベルを上げる必要はない。真に裕福な人は、無駄買いとかしないし。 #tama954
2022-01-20 15:15:47,#tama954　みんな上を上を目指しがち。
2022-01-20 15:15:47,要らんわｗｗｗ #tama954
2022-01-20 15:15:39,厚切りジェイソンさん、熱いねー！！いいねー！ #tama954
2022-01-20 15:15:38,金持ち通さん貧乏倒産 #tama954
2022-01-20 15:15:31,まあ、こう言う本を出した人は勝ちだよね #tama954
2022-01-20 15:15:29,やっぱり投資なのねえ… #tama954
2022-01-20 15:15:27,ネタのノリで金の話を力説されると内容が普通でもやべー奴にしか聞こえない厚切りジェイソンさん#tama954
2022-01-20 15:15:26,活明パパは何か投資してるかな　 #tama954
2022-01-20 15:15:23,そこはワーイジャパニーズピーポーだろ。。 #tama954
2022-01-20 15:15:23,これ本当に大事なことですよねいったん上げちゃった水準は簡単に下げられない#tama954 https://t.co/Hl6z7vRwIP
2022-01-20 15:15:14,たまちゃんみたいに色々あって金を買わされる話の方が入りやすい  #tama954
2022-01-20 15:15:04,あつ森のカブ価は、Excelで1年以上データ化してるけど、分析力がないから、 無駄に終わっている😅#tama954
2022-01-20 15:15:01,ジェイソンさん:WH〜Y！貯金ピーポーーー！   #tama954
2022-01-20 15:15:00,理屈は「健全な競馬好き」とあんま変わらんよな～＞生活を破綻させない範囲で「投資」する(^^； #tama954
2022-01-20 15:14:57,余らない。 #tama954
2022-01-20 15:14:56,ラジオでは爆笑しているけど、「手数料取られちゃってるよねー」という感じで現状把握していない人が多いこと自体が国としてまずい。日本が後進国になっていると言われているが、日本人自体も衰退していると考えるべき。たまむすびは純粋に楽しみたいけど、これだけは看過できなかった #tama954
2022-01-20 15:14:55,ひとりごと：、、、家賃と生活費だけでもう収支赤字なのてすが何か？o(～～;)　 #tama954
2022-01-20 15:14:46,別に目新しいことは何も言ってないけど凄い真っ当な話してる #tama954
2022-01-20 15:14:44,ローンで投資に回せねえのだ… #tama954
2022-01-20 15:14:39,お金が余らない… #tama954
2022-01-20 15:14:37,そうか…。なんか焦ってきちゃう… #tama954
2022-01-20 15:14:34,イエス！ジャパニーズ・ピーポー（笑） #tama954 https://t.co/qLcjwqOvXk
2022-01-20 15:14:24,長期的投資を推奨、と #tama954
2022-01-20 15:14:20,投資に回せるお金がないマン。#tama954
2022-01-20 15:14:10,日本人はお金を運用する仕組みがわからないから株や資産運用の話をされると理解できなくて嫌になってしまう。私もその傾向があるから、政治と同じように知らなくちゃなって思って勉強はしてるけど難しいのよね。 #tama954
2022-01-20 15:13:57,クリティカルなホワイジャパニーズピーポー。ありがとうございます#tama954
2022-01-20 15:13:56,誰か厚切りジェイソンに投票権をw #tama954
2022-01-20 15:13:54,投資や運用をやたら勧める人は自分たちの市場にお金を誘導してるんじゃないかと思っちゃう #tama954
2022-01-20 15:13:50,たまむすび　暮らしの経済担当：厚切りジェイソン #tama954
2022-01-20 15:13:39,#tama954　収入が増えたから、生活水準を上げる必要ない、確かに。
2022-01-20 15:13:35,赤江さん、わかって相づち打ってるのかなぁ。銀行家の娘としてのプライドがある…いや、赤江さんにはないか(笑) #tama954
2022-01-20 15:13:30,投資はやっぱり勉強に尽きると思う。銀行系のSEしてた時、いろいろ教えてもらった。…活かせているかは不明。 #tama954
2022-01-20 15:13:25,意外と地に足のついた真っ当なお金の話してる #tama954
2022-01-20 15:13:24,ちょっと大きな買い物を想定して消費税額を計算してみたらそれだけで憂鬱になって買う気が失せた。「稼ぐときにも使うときにも税金取ってたらそりゃ誰も金を使わなくなるよな」と思ったよ。 #tama954
2022-01-20 15:13:17,株取引で痛い目にあった身内の話しか聞かないから腰がひけるんだよなー #tama954
2022-01-20 15:13:10,厚切りさんは何に投資してるの　 #tama954
2022-01-20 15:13:00,WHY！バカ高手数料～！！ #tama954
2022-01-20 15:12:58,自社株売りたいんだけど、守秘義務がある部署なので、売れない…orz #tama954
2022-01-20 15:12:55,矛盾した日本語に憤慨するのではなく、ATMの手数料に憤慨する厚切りジェイソン氏…新たなフェーズに突入（もはやただの日本国民） #tama954
2022-01-20 15:12:50,意外と　フツーな節約術？ #tama954
2022-01-20 15:12:47,そうなんですよ昔は100万預けたら5万利息ついたんですよ（税金で2割取られるけど） #tama954
2022-01-20 15:12:44,ひとりごと。競馬、競艇、競輪でリスク分散（ギャンブル沼）　 #tama954
2022-01-20 15:12:44,投資、投資って言うけど、そんな金ねぇよ　#tama954
2022-01-20 15:12:41,個人型の確定拠出年金(iDeCo)や企業型確定拠出年金もあるからね #tama954
2022-01-20 15:12:39,ジェイソンさんの話、面白い。#tama954
2022-01-20 15:12:36,ATM一回の手数料で、金利分なんて吹っ飛ぶもんな。 #tama954
2022-01-20 15:12:27,社会的責任投資って考え方ももっと広めてもらいたいな…(社会的に有用な会社を選んでそこの株を買う(=投資する)) #tama954
2022-01-20 15:12:23,俺もATM手数料払いたくない( ･`ω･´)致し方ない時以外！ #tama954
2022-01-20 15:12:20,ごめんなさい #tama954
2022-01-20 15:12:16,#tama954　投資(^.^)
2022-01-20 15:12:15,自分も時間外でお金下ろさなくて良いように週末になる前に銀行で下ろすようにしてる。#tama954　コンビニATM で下ろすとかセレブなことはしない。
2022-01-20 15:12:14,手数料って、バカバカしいもんね #tama954
2022-01-20 15:12:10,FX戦士赤江さん爆誕する気配ある?(無さそう) #tama954
2022-01-20 15:12:10,手数料払うと負けた気がする #tama954
2022-01-20 15:11:59,手数料は馬鹿馬鹿しいよね #tama954
2022-01-20 15:11:58,普通預金で金利0.001%とかそんなんやんね #tama954
2022-01-20 15:11:54,ほんとねｗ自分の金を引き出して、お金とられているの、アホらしいｗｗｗ #tama954
2022-01-20 15:11:52,投資信託の積み立て始めた途端にリーマンショックが訪れて数年間冬の時代を過ごした自分には怖いものなど何も無いです #tama954
2022-01-20 15:11:46,信じてる信じてないじゃなく、勝手に持ってかれるんだよ…#tama954
2022-01-20 15:11:45,お金欲しい　#tama954
2022-01-20 15:11:41,すごい怒ってるww #tama954
2022-01-20 15:11:38,金利られた遊び #tama954
2022-01-20 15:11:31,まず、投資に回す金がないんだよな #tama954
2022-01-20 15:11:29,赤江さん・レオレオの子供の頃までは預金金利が凄かったらしいですね😅   #tama954
2022-01-20 15:11:27,@tos私もATMの手数料はかからないようにしてる無駄だもんね、本当に。 #tama954
2022-01-20 15:11:17,自分もATMの手数料は払いたくない　 #tama954
2022-01-20 15:11:16,私は月１回、まとめておろすよ。 #tama954
2022-01-20 15:11:07,この所支出が増えているから、抑えていかないとな(汗)店を作ってから、軌道に乗って落ち着くまでは抑えていかねば(汗) #tama954
2022-01-20 15:11:07,僕も最近はATMの手数料を取られないようにお金を預けたり引き出したりしてるで #tama954
2022-01-20 15:11:06,日本人がお金の話をおおっぴらにしないのはバブルで懲りたから…は無いか #tama954
2022-01-20 15:11:05,ウチの嫁はんおれが必死で稼いだカネ、毎回フツーに手数料払っておろしてたな。。 #tama954
2022-01-20 15:11:03,#tama954　ある分だけしか使わないとか。
2022-01-20 15:11:03,強制的に確定拠出年金の運用をさせられている… #tama954
2022-01-20 15:10:58,ATMはよくわかる。あれはバカだよ。  #tama954
2022-01-20 15:10:54,ひとりごと：金利よりも投資と、、、ギャンブルでは無いとφ(^_^;)　 #tama954
2022-01-20 15:10:50,家計簿つけてるのは世界でも　日本ぐらい #tama954
2022-01-20 15:10:46,いでことにーさで精一杯です #tama954
2022-01-20 15:10:42,ウチ武士じゃない #tama954
2022-01-20 15:10:40,ATMの手数料は本当にバカバカしい #tama954
2022-01-20 15:10:36,今は企業年金も危ないから各自でやってくれって流れになってないかな　 #tama954
2022-01-20 15:10:36,ついこないだパックンのラジオ聞いたばかりなので、混乱してる #tama954
2022-01-20 15:10:19,その簡単なアプリはどれだろう　#tama954
2022-01-20 15:10:16,#tama954 外出しないとお金使わなくなるよ(^^;
2022-01-20 15:10:14,ビットコイン買ったら落ちだした…… #tama954
2022-01-20 15:10:13,投資ってなると うちは株くらいしかやってへんなぁ #tama954
2022-01-20 15:10:13,またさっきの #so954 みたいに節約するなら現金よりも電子マネーとかに誰でも考え付きそうなこと言わないだろうね？#tama954
2022-01-20 15:10:08,最後になんかのアプリの宣伝で終わりそう #tama954
2022-01-20 15:09:54,お金の話が増えてるのは国民全体が貧しくなってるからですよ… #tama954
2022-01-20 15:09:53,お金の話しを大っぴらにはしないでもお金の話は大体みんな好きよね #tama954
2022-01-20 15:09:51,アプリ？スーさんとこでも同じ事聞いたな #tama954
2022-01-20 15:09:51,投資始めた途端に元本割れた　#tama954
2022-01-20 15:09:45,あと、住宅ローン完済まで6年… #tama954
2022-01-20 15:09:43,なんか今日のTBSラジオはナゾのチカラが働いてるの？？ #tama954
2022-01-20 15:09:36,ひとりごと：アメリカも日本も、学生ローン地獄とφ(～～;)　 #tama954 #ss954
2022-01-20 15:09:31,そもそも義務教育でお金のことを勉強しないからね。資産運用とか税金とかもっとやったらいいと思うんだけど。 #tama954
2022-01-20 15:09:25,#アシタノカレッジ では眠かったのね #tama954
2022-01-20 15:09:13,TBSラジオは厚切りジェイソン推しなの？ #tama954
2022-01-20 15:09:09,たまおさん…お金を貯めるには電子マネーがいいよ…ん？数時間前に聞いたような？ #tama954 #so954
2022-01-20 15:09:05,#tama954 コーヒーはお湯沸かしてインスタントコーヒー入れて飲むのが習慣化したな
2022-01-20 15:08:50,森永卓郎さんもお茶のパック買って空の水筒に入れて水道水入れてたな #tama954
2022-01-20 15:08:47,#tama954　さっきも同じような話を　#so954
2022-01-20 15:08:41,おい…どうしたんだよ…たまむすび……めっちゃタメになる情報を放送してるじゃないかい…（厚切りジェイソン氏のおかげ） #tama954
2022-01-20 15:08:40,見たくないものは見ない…クズだ俺…orz #tama954
2022-01-20 15:08:36,そうだよなあ、ついつい缶コーヒー買っちゃうんだよなあ。 #tama954
2022-01-20 15:08:31,お部屋でラジオが一番お金が減らない #tama954
2022-01-20 15:08:27,マイボトルとかでコーヒーを持ち運ぶのは容器を洗うのがめんどくさい #tama954
2022-01-20 15:08:25,スーさんの方に来たゲストと似たような展開に#tama954
2022-01-20 15:08:21,ホワ〜イ！ #tama954
2022-01-20 15:08:20,でも「経済を回そう回そう」って言われてるのよ　 #tama954
2022-01-20 15:08:12,声の圧が辛いただでさえ木曜はしんどいのに  #tama954
2022-01-20 15:08:05,コーヒーはインスタントよりもレギュラーの方が安上がりだけど。#tama954　手間を考えたらトントンかも。
2022-01-20 15:08:01,さりげなく本題に入ってて、講演会が始まった… #tama954
2022-01-20 15:07:55,ほあーい！ #tama954
2022-01-20 15:07:54,MEMO：支出を把握する＼(^o^)／　(^_^;)(^_^;)節約、、、ケチ？　 #tama954
2022-01-20 15:07:43,よくわからないので天引き一択…　 #tama954
2022-01-20 15:07:34,#tama954　まー貯まるコツは使わない事よね(~_~;)
2022-01-20 15:07:14,コーヒー3L！ #tama954
2022-01-20 15:07:02,お、お前は株主優太!(;｀・д)σ　　💶(´ー｀)┐#tama954
2022-01-20 15:07:01,ジェイソン流カップルの襲い方とかのほうが… #tama954
2022-01-20 15:06:58,レコーディングの重要性… #tama954
2022-01-20 15:06:56,コーヒー3L飲んで来てた(@_@)  #tama954
2022-01-20 15:06:55,お金の出納帳は大切ね #tama954
2022-01-20 15:06:54,癖でアルコール消毒してしまう… #tama954
2022-01-20 15:06:19,ハキハキしてる！ #tama954
2022-01-20 15:06:13,イリノイ州アーバナってHAL9000の生まれ故郷 #tama954
2022-01-20 15:06:05,#tama954　支出を把握すること。
2022-01-20 15:06:05,同じ理系なのに、カロリー摂取のコントロールしない俺…orz #tama954
2022-01-20 15:06:02,長野にも、よく来てくれる厚切りジェイソンさん、いつもありがとう✨ #tama954
2022-01-20 15:05:59,感情(勘定)がないぶん、っていうシャレだったのかな😃#tama954
2022-01-20 15:05:50,厚切ジェイソンさん改め博士、いつも息子に英語を語りかけてくれてありがとうございます。#tama954
2022-01-20 15:05:47,あっ事務所2人ともナベプロだっけ？ #tama954
2022-01-20 15:05:47,日本語勉強するためにエンタの神様見てお笑いにハマったらしいよね #tama954
2022-01-20 15:05:43,ぼーっとパッくんの顔を思い浮かべてた違った、ジェイソンだ　w　#tama954
2022-01-20 15:05:25,#tama954 雑な合成してみた https://t.co/q8KxGjdQpq
2022-01-20 15:05:24,厚切りジェイソンはもうEテレの人になってたのか、アップデートしてるんだなー #tama954
2022-01-20 15:05:21,「みどりくじらー」うちもだ。#tama954
2022-01-20 15:05:21,ジェイソンさん面白そうですが次の任務に向かいまーすまた明日～ヾ(*´∀｀*)ノもう明日縁側ラジオの日じゃーん#tama954
2022-01-20 15:05:08,日本史を勉強…ケン…t(ry #tama954
2022-01-20 15:05:06,パックンが、「邪魔な存在」と言っていた、厚切りジェイソンさん😅 #tama954
2022-01-20 15:05:05,インテリアデザイナー（明日です） #tama954
2022-01-20 15:05:04,昨日のアトロクですね #tama954 #utamaru https://t.co/GHUU7ZwkzF
2022-01-20 15:04:58,AJきた #tama954
2022-01-20 15:04:51,YouTubeで時々運用系のCMで見るような… #tama954
2022-01-20 15:04:38,#tama954#厚切りジェイソン さん‼️#コンフィデンスマンJP英雄編見ました～😆
2022-01-20 15:04:37,若い頃から資産運用。JPOP界の島田紳助orたむらけんじ？ #tama954
2022-01-20 15:04:33,優待で誤魔化されちゃダメだとw  #tama954
2022-01-20 15:04:31,ぶつ切りジャクソンさん #tama954
2022-01-20 15:04:24,みどりくじらー！をたまむすびで聴けるとは。笑 #tama954
2022-01-20 15:04:19,いいんじゃね？大声で騒ぐ人ってよりNHK教育で演じてる人の方が印象いいよ #tama954
2022-01-20 15:04:18,あの頃の子役ちゃん今auに出てるよね。#tama954
2022-01-20 15:04:14,はーい！パックン！！ #tama954
2022-01-20 15:04:13,#tama954　英語であそぼのみどりくじら　ごめん知らんかった💦　画像上げたくせに(￣▽￣;)
2022-01-20 15:04:11,#tama954 レオレオ、ガス3口使って１つにするって…知り合いの電通マンと同じ発想でわろた
2022-01-20 15:04:08,MEMO：ナベプロと役員の二刀流、厚切りジェイソンさん＼(^o^)／　(^_^;)(^_^;)５年前の使い回し？　 #tama954 #Eテレ
2022-01-20 15:04:08,@tos選挙特番で、厚切りさんって呼ばれてたな #tama954
2022-01-20 15:04:08,ピン太郎が知ってるDr. #tama954
2022-01-20 15:03:50,最終学歴が、おかしいｗｗｗ #tama954
2022-01-20 15:03:49,出たなうるさい外人ww#tama954
2022-01-20 15:03:47,「じぇねりっく」は清水ミチコで「イ〜ジョ〜」はニューヨークの嶋佐さんで再生される #tama954
2022-01-20 15:03:41,ピン太郎ちゃんも英語であそぼ見てるのね　 #tama954
2022-01-20 15:03:36,手袋モードあるよけっこー前からでも機種変したケータイ付いてないのー💔最新機種なのに色々とショボいいや端折られとる#tama954
2022-01-20 15:03:36,一瞬、ECCみたいに #tama954
2022-01-20 15:03:30,なんでコンピュータの修士からお笑いに…www #tama954
2022-01-20 15:03:20,正解わろた #tama954
