created_at,text,author_id,username,like_count,retweet_count
2023-01-11 14:20:20,騙して連れてきてるゲストｗ #tama954,15902911,manabuk1,3,0
2023-01-11 14:20:20,ウナギさん まだ20代なの！ 結構長いこと名前聞いてるのに #tama954,139413398,raingirl33,0,0
2023-01-11 14:20:14,大吉先生長生きして下さいね  #tama954,109089816,teleglamsaru,0,0
2023-01-11 14:20:13,豪華なゲストばかりだよね #tama954,145219861,HaseKen_1210,0,0
2023-01-11 14:20:10,博多大吉著「貴様いつまで生きるんだ問題」  #tama954,1109944122326970368,mmantle3,0,0
2023-01-11 14:20:06,誰誰？？ #tama954,482992075,ayaaya077,1,0
2023-01-11 14:20:02,さて来週のゲストは⁉︎、 #tama954,114987594,tanupocorin,2,0
2023-01-11 14:20:01,大吉大黒から大吉寿老人にクラスチェンジしそうね #tama954,116622878,1xprox1,1,1
2023-01-11 14:20:00,#tama954 #たまむすび ボクの一番古い年賀状は……37年前の、友人からの年賀状。その２年後に事故にあって、若くして他界してしまう友人からの年賀状は、捨てられないです(T_T),1293330343089459200,a_dream_type79,0,0
2023-01-11 14:19:58,続ひとりごと：、、、今思えば折り畳みガラケーも希少価値が(^o^;)　 #tama954,155949926,n_kotatu,0,0
2023-01-11 14:19:56,夢はご長寿。ｗｗｗｗ #tama954 #たまむすび,72782266,takalovin,0,0
2023-01-11 14:19:55,大吉先生のスキャンスナップかな。年賀状保存するのにデジタル化するのいいな。レンタルもあるはず ちなみに年賀状全部取ってある。。 写真は紙焼きスキャンして捨てたらデータ吹っ飛んで、ネガだけ残ってます。データ化するほどでもない、とそのまま、、 #tama954,61173695,jam_f_t,2,0
2023-01-11 14:19:50,スキャナー買わなくてもスマホでできそうだけど #tama954,1258603016564862976,tetsu_door,0,0
2023-01-11 14:19:41,スキャンして保存する年賀状管理ソフト  とかありそうだけど・・・・   #tama954,113888018,yamaatsoka,0,0
2023-01-11 14:19:33,年賀状は一昨年のまで残して後は残しておりませぬ #tama954,106931842,15az,0,0
2023-01-11 14:19:33,やっ！てやる＝スキャンで取り込む  #tama954,139413398,raingirl33,0,0
2023-01-11 14:19:29,年賀状なんて20年来貰ってないけど相手の住所書いて有ると処理が面倒そうだぜー。#tama954,3145074206,optnt1231,0,0
2023-01-11 14:19:24,年賀状配達のバイトしたとき、先生のところはスゴい数届けたね。1000枚以上の人もいたから、全部見るのかも疑問。あ～いう人は取っておくなんて無理だよ。 #tama954,1419510499398459397,KeLgzH26MaUAbDn,0,0
2023-01-11 14:19:17,年賀状、小学生の頃からあるし捨てられないや。#tama954,1276513657808027648,b4tW5gqRmIB8AFO,1,0
2023-01-11 14:19:10,ドキュメントスキャナーを送りましょう〜。   #tama954,50256849,vonkimura,0,0
2023-01-11 14:19:02,年賀状のあるあるをお焚き上げ、火力高め。 #tama954,785998809117569024,minori_n_ri_n,0,0
2023-01-11 14:18:59,いつまで生きるつもりだという眼ｗｗ #tama954,15902911,manabuk1,0,0
2023-01-11 14:18:54,年賀状、昨年引っ越すまでは30年分位取っていたけど…過去３年分残して後は全て処分済み。流石に嵩張っていたし。#tama954,841199181431693312,Auris_tyt,2,0
2023-01-11 14:18:49,3年前は過去(それはそう) #tama954,165019747,ykc_mg,0,0
2023-01-11 14:18:48,「私にだって夢はあるんだから、ご長寿っていう」草 #tama954,32862003,maak4793,0,1
2023-01-11 14:18:47,見直すから、未練が。#tama954,269195075,MST_SZK,0,0
2023-01-11 14:18:36,珠緒チョイス失敗！ #tama954,116622878,1xprox1,0,0
2023-01-11 14:18:36,切り捨てたwww #tama954,983856981977939969,Ggvg09,0,0
2023-01-11 14:18:33,2年ぐらい置いといて、その後は処分ですな #tama954,821302089762492416,55_fukaeri_,0,0
2023-01-11 14:18:29,年賀状は捨て方に気を遣う #tama954,121960751,lezelenoegao,0,0
2023-01-11 14:18:16,赤江家「3年前は過去」 #tama954,1109944122326970368,mmantle3,0,0
2023-01-11 14:18:16,うなぎさん！ おめでとうございます！  #tama954,1008171814416052224,Oceanbabe_,2,0
2023-01-11 14:18:12,@koo_poon  大ポス、採用おめでとうございます！ #tama954,1490362733635981313,has_bojji,1,0
2023-01-11 14:18:11,まぁ✨うなぎさん！ 今日はお仲間が続くわぁ😊💕  年賀状は私も捨てられないで10年くらい取ってあるw  #tama954,1368766297052356612,rainbowsheep925,0,0
2023-01-11 14:18:02,うなぎさん🌱 #tama954,1421497446379577346,T_motives_ata,1,0
2023-01-11 14:17:59,年賀はがきをスキャンして保存  #tama954,109089816,teleglamsaru,1,0
2023-01-11 14:17:55,うなぎさん、おめでとうございます🎉👏👏👏 #tama954,1540812566,mika_rinko,2,0
2023-01-11 14:17:46,捨てるのに迷うものは酔ったときにバンバン捨てるようにしている #tama954,1293763792069771264,YUP14N,0,0
2023-01-11 14:17:37,ひとりごと：年賀状ファイリング、、、骨董的な価値が出てきそう、知らんけどo(^ ^ )　 #tama954,155949926,n_kotatu,0,0
2023-01-11 14:17:35,そ、そんなに長く保管してるの？？#tama954,145482620,kagoshimaogojyo,2,0
2023-01-11 14:17:13,旅先の日帰り温泉でくじ引きで米30kg当たったことがあるが30kgを背負って旅を続けるわけにはいかないので次に並んでいた親子連れに上げたことがある。これは「徳を積んだ」と言えるだろう #tama954,90938310,Simon_Sin,47,2
2023-01-11 14:16:48,おお！うなぎさん！！ おめでとうございます  #tama954,136362689,jasminchachacha,2,0
2023-01-11 14:16:34,大吉(ガメラ)大黒様から贈られる赤江さんのおひつは、どんなものになるかしら…？ #tama954 https://t.co/mMEqPj80pl,123252486,tsukiko0325,162,15
2023-01-11 14:16:29,なかなか答えが出ないw #tama954,821302089762492416,55_fukaeri_,0,0
2023-01-11 14:16:25,古い年賀状は鍋敷にする。 #tama954,14082140,reiko_f,0,0
2023-01-11 14:16:22,#tama954  赤江さんの徳の基準、厳しいなぁ。。。,1326771224,suzuki_mogu,1,0
2023-01-11 14:16:17,徳を積む…もしかしてそれはABC浦川さんの教え…🙂？ #tama954,1117784476757577729,tama_at_6th,1,0
2023-01-11 14:16:12,とりあえずスキャナで取り込み(⌒-⌒; )#年賀状 #tama954,862533539761344513,kb958559,0,0
2023-01-11 14:16:11,#tama954 #たまむすび #ドライバーズリクエスト #tbsradio #TBSラジオ   ＞宮崎瑠依、第2子妊娠「順調にいけば初夏に出産予定」お腹ふっくら写真添え報告　夫は元プロ野球選手の荒波翔  | ORICON NEWS https://t.co/TeWcTqGBSO,109060654,absyaecg,2,0
2023-01-11 14:16:07,MEMO：年賀状の保管期間、、、どうしてます？　 #tama954,155949926,n_kotatu,1,0
2023-01-11 14:16:07,相談者の人一緒に居たら疲れそうな性格してるな ＃tama954,1600508784253730818,skbneeeee,0,0
2023-01-11 14:16:05,大吉大黒様の考え✍️ #tama954,785998809117569024,minori_n_ri_n,0,0
2023-01-11 14:16:03,paypayの抽選は音出ないようにして欲しいわい #tama954,1484564701,machine0016,1,0
2023-01-11 14:15:54,わかる〜！コンビニのくじ引きで、パンパンに膨れたポテチが当たってめっちゃ嵩張った事ある。ジャマ❗️ #tama954,1540812566,mika_rinko,2,0
2023-01-11 14:15:51,三番ショートうなぎさん採用 #tama954,1062244073119993856,Shinshin_kai,6,0
2023-01-11 14:15:44,赤江さんの徳を積むの基準が分からんw #tama954,1258603016564862976,tetsu_door,0,0
2023-01-11 14:15:23,大吉先生はもう経済的には全然困ってないでしょ。 #tama954,239296839,sekiraraeco,0,0
2023-01-11 14:15:18,あら！わたぬきさん！  抽選引かれますか？って ひとこと聞いてくれたら良かったんじゃないかしらん？ 勝手に振られたみたいになるしw  #tama954.,1368766297052356612,rainbowsheep925,5,0
2023-01-11 14:15:10,#tama954 普段買わないモノがあたる。なんとかドリンクとか。,785998809117569024,minori_n_ri_n,1,0
2023-01-11 14:15:10,「残念！」が嫌なのかな。「外れです。ありがとうございました」だったら？#tama954,269195075,MST_SZK,0,0
2023-01-11 14:15:02,#tama954 たとえハズレても「抽選させてもらえただけでもお得・ラッキー」って思うけどなぁ,1565478352118755328,curekamonegi,1,0
2023-01-11 14:15:01,コロナ禍になってから？コンビニの三角くじなくなったような #tama954,1293763792069771264,YUP14N,0,0
2023-01-11 14:14:55,あれで渋滞しちゃうと罪悪感はあるねー。#tama954,3145074206,optnt1231,3,0
2023-01-11 14:14:50,セルフレジにしたらもうあのくじ引くことがなくなった #tama954,104168147,fukubaya,0,0
2023-01-11 14:14:49,自分から進んで引いてハズレなら納得なのだけどひかされてハズレはちょっとダメージ。  #tama954,68919915,yasucom,1,0
2023-01-11 14:14:41,ワタヌキさんには厳しい大吉先生。 #tama954,239296839,sekiraraeco,0,0
2023-01-11 14:14:34,セブンや、ファミマのやつね。意外と当たるのよ💦 #tama954,785998809117569024,minori_n_ri_n,0,0
2023-01-11 14:14:22,paypayの3等はショボすぎる #tama954,1404795821686673408,tsutomudayo954,3,0
2023-01-11 14:14:22,好きでもない人に勝手にふられたみたいな納得のいかなさあるんだよな笑 #tama954,1484030894088536070,jackradiojack,1,0
2023-01-11 14:14:19,ひとりごと：、、、抽選箱に手を突っ込んだら負けとφ(^ ^;) 　#tama954,155949926,n_kotatu,1,0
2023-01-11 14:14:17,kindle ペーパーホワイト　使ってたけど、ページの切り替えに時間かかるのが気になった　現行機は違うのかな　 　#tama954,203359937,NRT0,0,0
2023-01-11 14:14:08,今年の大吉大黒様はきまえがいいなぁー  #tama954,1135110173092040705,tangeri02730662,0,0
2023-01-11 14:13:58,タブレット、iPadMiniになると一気に10万仕事なんだよね… #tama954,1109944122326970368,mmantle3,3,0
2023-01-11 14:13:57,抽選のわたぬきさん！ #tama954,1421497446379577346,T_motives_ata,4,0
2023-01-11 14:13:35,そういうくじ引きは ハズレは入れない方がいいってことだね　  #tama954,139413398,raingirl33,1,0
2023-01-11 14:13:32,四月一日でわたぬき、って読ませるアニメのキャラいたね。北陸にある名前なんだとか。 #tama954,1419510499398459397,KeLgzH26MaUAbDn,1,0
2023-01-11 14:13:28,宮崎がヤフーニュースのトップに #tama954 https://t.co/4zCXDmu7vG,222741807,monteblue_net2,3,0
2023-01-11 14:13:26,あれ？今週も噛み合ってない？ #tama954,1573530952944746496,raditelespo,0,0
2023-01-11 14:13:19,コンビニのくじ 当たるまで何度も引かされたことがあったわ #tama954,1258603016564862976,tetsu_door,0,0
2023-01-11 14:13:11,大吉先生、ProMAXでもキツイのか… 電書を8インチタブから iPhone15proMAX(仮)に移行しようとしていた私、計画が狂う(ﾉ∀`)ｱﾁｬｰ #tama954,1109944122326970368,mmantle3,0,0
2023-01-11 14:13:08,わかる、残念がられるくらいなら最初から何も起こらない方が遥かにマシ笑 #tama954,1484030894088536070,jackradiojack,1,0
2023-01-11 14:13:02,某PayPayですね🤣  #tama954,1019024300869742592,Mio25589690,1,0
2023-01-11 14:12:59,わかるわPayなんとかの「ざんねん❗️」を見ると「やかましいわ！」て言いたくなるw #tama954,1167969919520006144,OtterOperator,2,0
2023-01-11 14:12:56,ひとりごと：真面目な話、抽選を棄権する権利は欲しいなぁと、、、御籤とかo(^ ^;)　 #tama954,155949926,n_kotatu,0,0
2023-01-11 14:12:45,仕事で電子機器(パソコン･スマホ･タブレットetc)使ってると、ある程度の世代は、ゲームしてる としか思ってくれない。   #tama954,178145389,KuniatsuSUN,0,0
2023-01-11 14:12:25,「ぢんねんでした」   #tama954,157298035,pikatti025,0,0
2023-01-11 14:12:21,ねこむすめさん👏🎉 おめでとうございます モヤシの種🌱 #tama954,106931842,15az,3,0
2023-01-11 14:12:20,タブレットと聞くとタブ純さんの顔が脳裏に #tama954,1310788951670579200,the_Wayitis_65,0,0
2023-01-11 14:12:19,勝手に抽選、勝手に「残念！」良いネタだな！ #tama954,43058241,cosmicnoise,1,0
2023-01-11 14:12:06,タブレットが思い人は膝の上にクッション乗っけたり、タブレット用のアームをベッドにつけてセットすると手が楽だよ。 布団に入ってスマホをアームにセットしてBluetoothのマウスを繋げれば手を出さずにスマホをいじれる！  #tama954 https://t.co/DNlsGJvuU2,4431177912,popin954,4,0
2023-01-11 14:12:02,タブレット純さんは、ギター漫談かな？@janesu112  さん！#生活は踊る　#tama954,785998809117569024,minori_n_ri_n,0,0
2023-01-11 14:11:48,ねこむめさん！  じゃあタブレットを大吉大黒様が…となれば良かったのにw  #tama954,1368766297052356612,rainbowsheep925,5,0
2023-01-11 14:11:44,PayPayでよく「ざんねん」見かける(⌒-⌒; ) #tama954,862533539761344513,kb958559,0,0
2023-01-11 14:11:44,スマホを見てるだけなのに #tama954,1264565107482189824,hiro_omotegawa,2,0
2023-01-11 14:11:41,スマホをタブレットに変える それって解決になってるのかな #tama954,1258603016564862976,tetsu_door,0,0
2023-01-11 14:11:40,勝手にくじ引きさせられてハズレが出て「残念」w  #tama954,114987594,tanupocorin,0,0
2023-01-11 14:11:38,MEMO：突然の抽選でハズレ、で、残念モヤモヤ、、、　 #tama954,155949926,n_kotatu,0,0
2023-01-11 14:11:31,画面は裏側に発光面があるから  本とは目の疲れ方が根本的に  違うと思います   #tama954,113888018,yamaatsoka,0,0
2023-01-11 14:10:51,タブレット、夫さんにプレゼントしてあげたら ハイ解決！ #tama954,2210747041,kawamachihiro,0,0
2023-01-11 14:10:50,わたぬきさん採用 #tama954,1062244073119993856,Shinshin_kai,2,0
2023-01-11 14:10:47,スマホのサイズだと老眼にはつらい #tama954,18899541,nikuya298,0,0
2023-01-11 14:10:40,タブレットと聞くと、純がくるwww裏番組だ！ #tama954,785998809117569024,minori_n_ri_n,2,0
2023-01-11 14:10:39,やっぱ電子書籍なら2台目タブレットで 寝ながら読んでて鼻に落とすまでがセット！痛  #tama954,486528886,Tokyo_Ricks,3,0
2023-01-11 14:10:38,老眼じゃないけどうちの夫も最近電子書籍ばかりだからずーっとスマホ見てる。 だいぶ慣れた。 慣れ、かも。   #tama954,894770924267814918,gas_ska0253,1,0
2023-01-11 14:10:27,タブレットは手が疲れる…あっ立てかけて読めばいいのか #tama954,107016300,hanyu_usa,0,0
2023-01-11 14:10:23,スマホで漫画はいいけど読書だと文字が入っていかないなあ やっぱり紙で読みたい  #tama954,3262736684,kawasister,0,0
2023-01-11 14:10:20,ド近眼＋老眼だと、メガネ外して距離合わせれば文庫本の字全然読めるけどな #tama954,1573530952944746496,raditelespo,0,0
2023-01-11 14:10:06,Kindleの読書専用のタブレットとかあるし、iPadなら読書だけじゃなくカーナビとしてとか孫とのリモート会話にも使いやすいよ  #tama954,4431177912,popin954,2,1
2023-01-11 14:09:53,Kindleにしよ、Kindle #tama954,584611275,__Tsukico,0,0
2023-01-11 14:09:53,ニュースの中継で、記者さんのメモがスマホになったよね アレ、最初すごい違和感だった  #tama954,139413398,raingirl33,0,1
2023-01-11 14:09:50,#tama954 タブレットは重たいんだよな。,102011794,a_rimit,3,0
2023-01-11 14:09:40,もしや来週の凄い人って、でか美ちゃんさん？ #tama954 https://t.co/y9eYpVe6TM,1898062195,otonosuzu,2,0
2023-01-11 14:09:35,ねこむすめさん👓 #tama954,1421497446379577346,T_motives_ata,1,0
2023-01-11 14:09:34,確かにタブレットならいいかも！ #tama954,1179968768769871873,musume_cat,1,0
2023-01-11 14:09:25,私はシャンプー・リンスして 柑橘系の匂いや香りが丸一日漂う  ワク接種者の薬品臭は本当に 周りの人達が迷惑を被る…隔離 してもらいたい   #tama954,1118368286,QueenARZ,138,13
2023-01-11 14:09:25,スマホじゃなくてタブレットにしてもらうとか（そういうこと？） #tama954,18184151,natsumikan_t,0,0
2023-01-11 14:09:18,MEMO：旦那さん。読書なのに、ずっとスマホでモヤモヤ、、、タブレットならと大吉先生。　 #tama954,155949926,n_kotatu,0,0
2023-01-11 14:08:53,電子書籍はタブレットです #tama954,32862003,maak4793,0,0
2023-01-11 14:08:51,広駅はマジで臭い。でも、年月が経ってるから、もうあの臭いはなくなったのかな？ #tama954,821302089762492416,55_fukaeri_,0,0
2023-01-11 14:08:37,合間に良い匂いのシェアも織り交ぜていけば良いんだろうね。 #tama954,2855276306,endofmyresource,0,0
2023-01-11 14:08:31,ねこむすめさん！ あたしも、ずーっとスマホとタブレットみてます。。。 #tama954,3632462718,suusanja,4,0
2023-01-11 14:08:19,おっと、昼休み終わってたw さいなら(・ω・) #tama954,1389157969208627200,AmanoJack_0410,0,0
2023-01-11 14:08:15,スマホで読書って老眼進まない？(￣▽￣;)#せめてタブレット #tama954,862533539761344513,kb958559,2,0
2023-01-11 14:08:11,変なサイトを見ているわけではない……そうとは限らないかも😅 #tama954,621275165,nekotowolf,1,0
2023-01-11 14:08:07,#tama954    最近、受けるのが、わっさんの猫、ねねこのアウト判定。www https://t.co/peE91MDAvI,108481807,tkphantom,1,0
2023-01-11 14:08:06,やったー！！ 今年初採用です☺️ #tama954,1179968768769871873,musume_cat,24,0
2023-01-11 14:07:58,ねこむすめさん採用 #tama954,1062244073119993856,Shinshin_kai,3,0
2023-01-11 14:07:49,刺激的な遊びww #tama954,983856981977939969,Ggvg09,0,0
2023-01-11 14:07:43,#tama954 まず前提として「この驚きを他人にも教えてあげたい」って気持ちがあって、匂いの場合は驚きを抱くものは良い匂いより悪い匂いの場合が圧倒的に多いからじゃないかな。,1565478352118755328,curekamonegi,0,0
2023-01-11 14:07:27,手のひらを擦るといい匂いするよ やってみな 相手の手をバーン 鼻イタタ やらなかった？ #tama954,1389157969208627200,AmanoJack_0410,1,0
2023-01-11 14:07:25,にぎりっ〇の心理？  (*´∀｀)   #tama954,113888018,yamaatsoka,1,0
2023-01-11 14:07:20,ひとりごと：個人的に暴論だけど、、、生命に危険のあるガスって、臭い少なめな気がo(^ ^;) 　#tama954,155949926,n_kotatu,0,0
2023-01-11 14:07:16,（希望）長峰親方。 #tama954 https://t.co/S5e6rVqCMx,1898062195,otonosuzu,2,0
2023-01-11 14:07:15,クサイ臭いは、なぜか二度嗅ぎしたくなる不思議！ #tama954,1553781551732707328,ponzu_zamurai,1,0
2023-01-11 14:07:12,でか美ちゃん元気にしてるかな？ またゲストに来て欲しいな  #tama954,109089816,teleglamsaru,2,0
2023-01-11 14:06:47,異臭のシェアはされるのはイヤだけどしたいのはわかる。 #tama954,2855276306,endofmyresource,0,0
2023-01-11 14:06:46,大吉の女 大吉「でか美ちゃんかな？」w #tama954,100954281,ryuseiguntear,3,0
2023-01-11 14:06:36,でかいみみくそ取れたら見せにくるニキどんみたいな女性いるよね ※ニキどん関係ありません #アシタノカレッジ　 #tama954,144413877,ttype911,1,0
2023-01-11 14:06:20,あなたも忍者だったの！？ #tama954,239296839,sekiraraeco,1,0
2023-01-11 14:06:09,#so954 #生活は踊る #tama954 #ss954 #アシタノカレッジ #tbsradio #TBSラジオ https://t.co/tG5CD7HhPe,1898062195,otonosuzu,3,1
2023-01-11 14:06:06,フレーメン反応の一種とか？  #tama954,4431177912,popin954,0,0
2023-01-11 14:06:06,#tama954 を聞きながら作り置きおかず作ると良いことあるのね。。,785998809117569024,minori_n_ri_n,0,0
2023-01-11 14:05:45,ガメラマーチ、作詞は永田守氏の父。 #tama954  https://t.co/tvaZI0NP5l,621275165,nekotowolf,4,0
2023-01-11 14:05:44,大吉先生「でか美ちゃんかな」 そろそろでか美ちゃんをこのコーナーに呼んで欲しい  #tama954,3262736684,kawasister,9,2
2023-01-11 14:05:41,嗅がせる時に何も考えてねぇって #tama954,1258603016564862976,tetsu_door,0,0
2023-01-11 14:05:31,数年ぶりに大吉大黒様をリアタイできるというのに、全然ほしいもの思いつかん自分が悲しい… #tama954,18184151,natsumikan_t,3,0
2023-01-11 14:05:20,大吉先生の女感という話で「でか美ちゃんかな？」と名前があがるでか美ちゃん #tama954,142156894,right_pachi,8,2
2023-01-11 14:05:10,大吉の女からでか美ちゃんと繋がるの 微笑ましい☺️  #tama954,732166946230128640,yayakoshy,3,0
2023-01-11 14:05:05,毎週、臼井ミトンさんが呼びかけるハメになってたかもしれない残りふたつ（笑） #tama954 #金曜ボイスログ https://t.co/fB62sv3Sk8,1898062195,otonosuzu,5,0
2023-01-11 14:04:51,臭いものを嗅がせるw #bananamoon かよっw #tama954,606470604,_taronosuke__,1,0
2023-01-11 14:04:46,大吉の女(おみくじ) 大吉のオンナ(でか美ちゃん) #tama954,165019747,ykc_mg,0,0
2023-01-11 14:04:45,MEMO：ニオイに敏感リスナーさん、、、『ちょっと嗅いでみて』にモヤモヤ　 #tama954,155949926,n_kotatu,0,0
2023-01-11 14:04:37,さっきのがかの有名なECCカッター(違  #tama954,3316856858,sakekwtb,2,0
2023-01-11 14:04:25,確かに。平成3部作だと勝手に思っていたけど、昭和の可能性も全然ある。 #tama954 https://t.co/OU2hpum9rB,1490362733635981313,has_bojji,2,1
2023-01-11 14:04:22,ラジオネーム ボケ山田洋さんw #tama954,222741807,monteblue_net2,1,0
2023-01-11 14:04:10,今年はお仕事が入ってたため大吉大黒様には参加できませんでした、残念 #tama954,361046873,Usaruman,1,0
2023-01-11 14:04:09,お馬さん関連グッズって高いよねって、どうするんだろ？#tama954,821302089762492416,55_fukaeri_,1,0
2023-01-11 14:04:08,おモテになるのか色々ゆるいのか モノはいいよう #tama954,3262736684,kawasister,1,0
2023-01-11 14:04:03,私も筑波山神社で大吉だった〜♫ #tama954 https://t.co/cUlKVZ9hQa,606470604,_taronosuke__,1,0
2023-01-11 14:03:57,＼ そーだ そーだ ／  #tama954 https://t.co/VXTvEMcK6v,1389157969208627200,AmanoJack_0410,4,0
2023-01-11 14:03:46,いつの間にかうなぎが正解に！ ∈(ﾟ◎ﾟ)∋ #tama954 https://t.co/eRD3y39HmH,134622257,gaoqiaoren,3,0
2023-01-11 14:03:42,バツ2は何かしら人間性に難ありだと思うぜー。#tama954,3145074206,optnt1231,0,0
2023-01-11 14:03:36,でも放送中に気付けなかったので、そのまま孵卵器プレゼント。 何年経ってもネチネチ言われる事に（笑） #tama954,1898062195,otonosuzu,1,0
2023-01-11 14:03:35,大吉の女（御神籤を引き直した女） 大吉のオンナ（デカ美ちゃん）w  #tama954,486528886,Tokyo_Ricks,3,0
2023-01-11 14:03:32,今年の大吉大黒様、いつもより羽振りがいい？いつもこんなに買いましょう！ってなってたっけ？w #tama954,1048071958288461826,radio_iiniku,1,0
2023-01-11 14:03:25,「今のは誰々の分」 大凶を人に押し付ける？(￣▽￣;) #tama954,862533539761344513,kb958559,1,0
2023-01-11 14:03:21,お寺のおみくじはは手加減しないところが多いよ。 #tama954 アタシは浅草寺で3年連続凶w,873354615869235200,koketsuatsuboy,2,0
2023-01-11 14:03:17,芸名候補 「博多華丸・大吉」or「ゴモラとガメラ」 「玉袋筋太郎」or「シロマティ」or「蟻の門渡り哲也」 #tama954,109491434,mo10fu_3,3,0
2023-01-11 14:03:16,しろ！しろ！っていう人に限って、実際するとまた色々言う。   #tama954,178145389,KuniatsuSUN,0,0
2023-01-11 14:03:09,MEMO：先週のおみくじリスナーさん、、、別の所で引き直したと御返事。 　#tama954,155949926,n_kotatu,1,1
2023-01-11 14:03:07,ECCカッターの件はスルーなのねw #tama954,1493963445779464194,wakizashi_taro,2,1
2023-01-11 14:03:07,#tama954 🐎馬用グルーミングブラシ。 https://t.co/OpZRGNfCaB,208041095,mari_fortepiano,1,0
2023-01-11 14:03:00,大吉大黒様、渋ってた（！）年もあったけどみんな叶えてくれそうな2023　#tama954,1276513657808027648,b4tW5gqRmIB8AFO,0,0
2023-01-11 14:02:57,まぁでもたった一文字の間違いでここまでリスナーに浸透させる遠藤泰子さんのすごさを改めて思い知るよな #tama954 https://t.co/DAjEDCVhBf,134622257,gaoqiaoren,4,0
2023-01-11 14:02:51,誤解されちゃううw  #tama954,114987594,tanupocorin,0,0
2023-01-11 14:02:50,それを木村祐一に言える？(やめてやれ) #tama954,140404580,hitau,0,0
2023-01-11 14:02:50,話が時報までにまとまらないしそのフォローもしないのにモヤモヤする  #tama954,109089816,teleglamsaru,1,1
