created_at,text,author_id,username,like_count,retweet_count
2023-01-11 13:39:12,言っちゃって良いの？#tama954,476448498,FriendNaginagi,1,0
2023-01-11 13:39:06,手相って虫メガネより老眼鏡じゃない？  #tama954,4431177912,popin954,2,0
2023-01-11 13:39:05,それはバケラッタじゃ！　#tama954 https://t.co/O3pcVbgjFt,136619312,Ryoko108,7,0
2023-01-11 13:39:03,あけましておべんとうごさいます✨  #tama954,1404795821686673408,tsutomudayo954,0,0
2023-01-11 13:38:59,佐賀牛でテンションが上がっている大黒大吉様ww 今なら願いが叶う確変発生中😂 #tama954,264737210,todddddddy,3,0
2023-01-11 13:38:51,はーい😃買いまーす😃 by大吉大黒様 #tama954,817553979026485248,mana_k2,2,0
2023-01-11 13:38:49,夕ご飯の支度してた、うそーん！ #tama954,785998809117569024,minori_n_ri_n,2,0
2023-01-11 13:38:41,655円(⌒-⌒; ) #tama954,862533539761344513,kb958559,1,0
2023-01-11 13:38:40,送料の方が高い！#tama954,476448498,FriendNaginagi,0,0
2023-01-11 13:38:39,655円ｗ断りづらいｗｗ #tama954,15902911,manabuk1,2,0
2023-01-11 13:38:33,この！小童（こわっぱ）めが！ #tama954,1389157969208627200,AmanoJack_0410,1,0
2023-01-11 13:38:31,手相といえば島田秀平さん  #tama954,4431177912,popin954,1,0
2023-01-11 13:38:23,曲げわっぱは食べたらすぐ洗わなきゃないものもあるよね  それで諦めた  #tama954,3262736684,kawasister,5,0
2023-01-11 13:38:23,#tama954 曲げわっぱ弁当箱の例。郷土愛？ https://t.co/nLjumUS8AM,208041095,mari_fortepiano,3,0
2023-01-11 13:38:22,一発目で買い決定は珍しかあ。　#tama954,317670944,thundc,1,0
2023-01-11 13:38:20,@xxx 普通に暮らしていたら佐賀に行くことはないけど、佐賀牛はほしい🐄   #tama954,86561354,mackey1984,0,0
2023-01-11 13:38:20,曲げわっぱ、曲げわっぱ！（O次郎） #tama954,151906098,om4ti,3,0
2023-01-11 13:38:20,金じゃなく金色か　びっくりした #tama954,15902911,manabuk1,1,0
2023-01-11 13:38:18,うひょー！！ #tama954,785998809117569024,minori_n_ri_n,1,0
2023-01-11 13:38:13,大吉先生今年は太っ腹  #tama954,109089816,teleglamsaru,0,0
2023-01-11 13:38:13,曲げわっぱは良いぞ。高いけど。 #tama954,94743112,mochiwo3,0,0
2023-01-11 13:38:13,もう今日のゲスト佐賀牛でいいか  　　　　(´･∀･)((´ー｀) ※裏の会話  #tama954,3109201472,ssgtr1,2,0
2023-01-11 13:38:09,大吉大黒様が佐賀牛のおかげでテンションがおかしくなっている。何か入っていやしないか　 #tama954,95584469,yokkorasho,1,0
2023-01-11 13:38:07,おっ、今年は1件目から採用か 今年はかなり期待できるんじゃないの #tama954,1258603016564862976,tetsu_door,0,0
2023-01-11 13:38:02,曲げわっぱ弁当箱かっこいいね #tama954,144413877,ttype911,0,0
2023-01-11 13:37:58,曲げわっぱ弁当箱ってシンプルに見えてなかなか高級じゃなかったっけ?工芸品だし #tama954,116696183,nagaredamashii,3,0
2023-01-11 13:37:47,佐賀牛のアシストあり #tama954,4431177912,popin954,2,0
2023-01-11 13:37:46,ってことはこっそり大吉大黒様にお酒飲ませたら全部即決してくれる？#tama954,476448498,FriendNaginagi,1,0
2023-01-11 13:37:37,即欠すると、トカゲの孵卵器のにのまえに… #tama954,2156235379,nitoro19730821,0,0
2023-01-11 13:37:36,おおー！！お弁当箱おめでとうございままーす！  #tama954,52409392,rb_blue,0,0
2023-01-11 13:37:22,俗に言うドカベンやね #tama954,140404580,hitau,0,0
2023-01-11 13:37:13,じゃあやっぱりみんなに佐賀牛をw  #tama954,114987594,tanupocorin,0,0
2023-01-11 13:37:08,あら素敵！曲げわっぱのお弁当箱  #tama954,136619312,Ryoko108,2,0
2023-01-11 13:37:05,佐賀牛でテンションが上ってるｗ #tama954,15902911,manabuk1,1,0
2023-01-11 13:37:03,MEMO：リスナーさんから大吉大黒様へ陳情、曲げわっぱ弁当箱、、、予算確認しないの？(^ ^;)　 #tama954,155949926,n_kotatu,0,0
2023-01-11 13:37:00,#大吉大黒様 まず１人目は曲げわっぱ弁当が確定   #tama954,4431177912,popin954,3,1
2023-01-11 13:36:50,おお！珍しく一通目で即決！#tama954　単価安いのは即決してくれるのね。,476448498,FriendNaginagi,1,0
2023-01-11 13:36:46,大黒さま即決！  #tama954,847609967389450241,BABANANAMOON,2,0
2023-01-11 13:36:43,あらあっさりと！！ #tama954,222741807,monteblue_net2,2,0
2023-01-11 13:36:41,おお、一枚目で！  #tama954,1251796897,hajime602,2,0
2023-01-11 13:36:37,曲げわっぱ弁当って耐久性どうなんやろ？  #tama954,4431177912,popin954,0,0
2023-01-11 13:36:34,1月の季語「大黒大吉様」www #tama954,264737210,todddddddy,0,0
2023-01-11 13:36:32,正味、はぴねすくらぶさんの企業努力もあるけど、それ以上に保冷倉庫の電気代がシャレにならないレベルで高騰してるから、メーカーさんも在庫寝かせるほど損するんだよね。 #tama954,2584471801,mo_Purple_,1,0
2023-01-11 13:36:26,曲げわっぱ弁当良いねえ　 #tama954,114987594,tanupocorin,2,0
2023-01-11 13:36:09,はぴくらの始まる時のBGMってオリジナルなのかな？聞くたびに楽しくなるからイージーYesでフルで流してほしい。#tama954,476448498,FriendNaginagi,1,0
2023-01-11 13:36:01,まげわっぱいいね #tama954,15902911,manabuk1,2,0
2023-01-11 13:35:39,#tama954 佐賀牛の焼肉丼の例！下にご飯🍚が…。 https://t.co/HGwB88XVpm,208041095,mari_fortepiano,2,0
2023-01-11 13:35:13,大吉大黒様にはぴねすくらぶをねだるTL  #tama954,109089816,teleglamsaru,4,1
2023-01-11 13:35:06,この後TBSラジオで13:42頃から【#朗読のミカタ 】  ◆世の中のありとあらゆる文章をプロが読む朗読エンターテインメント番組 ◆今週は、今年の干支が“卯（うさぎ）”ということで「うさぎにまつわる楽曲」の歌詞を、TBS外山惠理アナが朗読！  #tbsradio #radiko #tama954 https://t.co/Zb56Re4ukx https://t.co/j6aUuPKvus,169773563,TBSR_PR,155,16
2023-01-11 13:34:56,はぴねすくらぶさんの美味しそうな商品をきくたびに冷凍庫を増やしたくなる。 しらす２キロ買った竹山さんとかコストコで大量買いする人とか冷凍庫複数台もってるのかな。  #tama954,4431177912,popin954,5,0
2023-01-11 13:34:36,さすがにウルトラマンのお櫃は見つからない ていうかキャラもののお櫃ってない  #tama954,3262736684,kawasister,2,0
2023-01-11 13:34:21,ありゃした！不在　#tama954,476448498,FriendNaginagi,0,0
2023-01-11 13:34:12,大吉大黒様 佐賀牛食べたいです お願いいたします #tama954,1543479652177457153,ltukStoY5O0Mn0X,2,0
2023-01-11 13:34:05,はぴねすくらぶの佐賀牛🐄 大盤振る舞い　 #tama954,136619312,Ryoko108,1,0
2023-01-11 13:33:35,大吉大黒様、はぴねすさんの佐賀牛をください #tama954,222741807,monteblue_net2,3,1
2023-01-11 13:33:29,こうやってはぴくらさんみたいに企業努力すればある程度は安く売れるのにどいつもこいつも値上げ値上げって。#tama954,476448498,FriendNaginagi,0,0
2023-01-11 13:33:29,喋り方。って大事だな。と言うコトが伝わる今日の通販コーナー。 #tama954,94513415,PONSKE_ZZ,0,0
2023-01-11 13:33:03,２キロで２５人前ってことはひとり８０グラム、、、そんなもん？ #tama954,15902911,manabuk1,0,0
2023-01-11 13:33:01,ひとりごと：、、、ギリギリ大黒様に頼めるお値段？（しかも大増量！）　 #tama954,155949926,n_kotatu,1,0
2023-01-11 13:33:00,「寮母にオススメ！」ニッチすぎるw #tama954,110934838,cianfrocco,3,1
2023-01-11 13:32:58,寮母さんにお薦めしたくなる、という発想が、赤江さんらしい・・・w #tama954,828961162695880704,shi_much2,3,1
2023-01-11 13:32:53,ユニクロの値上げに一般人の所得が追いつかない地獄絵図！！もう全裸で生きるしかない…（極端） #tama954 https://t.co/rOaf2o4sgM,222741807,monteblue_net2,3,0
2023-01-11 13:32:22,出た！はぴくらさんのどーかしてる値段設定！#tama954,476448498,FriendNaginagi,1,0
2023-01-11 13:32:08,大吉大黒様、佐賀牛の焼肉を食べてみたいです　 #tama954,95584469,yokkorasho,1,0
2023-01-11 13:32:08,中古販売だと、バンダイの京本コレクションかと思ったらストロンガー無かったな。　#tama954  大きいサイズで精度出すバンダイ（＝工場のおっちゃん）の努力作。,69162065,hayama01,1,0
2023-01-11 13:32:02,じゃこれを大吉先生にお願いをw #tama954,140404580,hitau,2,0
2023-01-11 13:31:54,大吉大黒様へメール差し上げました。  #tama954,2613135571,yamaya_seiji,4,0
2023-01-11 13:31:45,アビスパ福岡サポーターたち「福岡人が佐賀牛に舌鼓を打つなんて許されない」 #tama954,222741807,monteblue_net2,2,0
2023-01-11 13:31:35,#tama954 佐賀牛いろいろ！ https://t.co/EteqjFU7g1,208041095,mari_fortepiano,1,0
2023-01-11 13:31:22,大吉大黒様に欲しい物があってもプレゼン能力が皆無なので最初からメールを送らないでいる #tama954,817553979026485248,mana_k2,5,1
2023-01-11 13:30:47,そちらは先行して昨年中に済ませてますね。 ここからさらに販売価格が上がるとGUへ移行するユーザーも増えそうですが。 #tama954 https://t.co/C86VT5oCbg,2584471801,mo_Purple_,2,0
2023-01-11 13:30:46,怪獣ヤキニクドン #tama954,1062244073119993856,Shinshin_kai,2,0
2023-01-11 13:30:22,大吉大黒様！ はぴねすくらぶの焼肉をお願い致します！(笑)  #tama954,972002393792528385,junglekuroemon,0,0
2023-01-11 13:30:15,お肉〜！　#tama954,165019747,ykc_mg,1,0
2023-01-11 13:30:14,#tama954 アサヒ軽金属の真空スムージーメーカーはメーカーから直接届くっと…✍️w https://t.co/Nwti6V6O5j,208041095,mari_fortepiano,1,0
2023-01-11 13:30:00,本日の #TBSラジオ #tama954  では、佐賀牛のタレ漬け焼肉セットのご紹介！ ブランド和牛「佐賀牛」を堪能できる、はぴねすくらぶ限定の焼肉セット！ 特製タレで味付けした厚切りのお肉は、ただただ美味しいの一言です。。。 お家焼肉を心ゆくまでお楽しみください☺️✨ https://t.co/Qd4Oi1vbTO https://t.co/7WDQrYUKdR,847621037369942017,e_hapi_com,14,1
2023-01-11 13:29:13,今日のはぴねすくらぶは新春セール #tama954,817553979026485248,mana_k2,0,0
2023-01-11 13:29:10,いるものが思いつかない。 満たされているのか？ #tama954,2855276306,endofmyresource,2,0
2023-01-11 13:29:01,@hajime602 そうですよね！ さすがに「読まれてない」は…ないと思っているので感謝の気持ちを伝えられただけで満足しています。  #tama954,1577628513448132608,tokkankorosuke,1,0
2023-01-11 13:28:54,牛肉たべたい。。。  #tama954,52409392,rb_blue,0,0
2023-01-11 13:28:42,A5はサシが多すぎて逆に苦手 #tama954,15902911,manabuk1,0,0
2023-01-11 13:28:33,大吉先生がビビるほどのゲストってだれ？#tama954　俳優さん？歌手？,476448498,FriendNaginagi,0,0
2023-01-11 13:28:12,誰とでも寝るウルトラマンでもお櫃とは流石に寝ないのか  #tama954,109089816,teleglamsaru,0,0
2023-01-11 13:28:11,若松さんじゃなかったか 何を大黒様にお願いするか聞きたかったｗ #tama954,287100173,hitstw,1,0
2023-01-11 13:28:10,なるほどですね  #tama954,582301255,onitang_saitama,0,0
2023-01-11 13:27:55,ダメ元で大吉大黒様へのリスエスト送ったぞ！  #tama954,4431177912,popin954,3,0
2023-01-11 13:27:45,贅沢しなくとも、節約を考えなくていい給与が欲しいですね。それが30万くらいかな。貯金もしたいし。  #tama954,1490362733635981313,has_bojji,0,0
2023-01-11 13:27:43,MEMO：はぴねすショッピングは、、、スタジオに焼肉セット？ 佐賀牛！ 　#tama954,155949926,n_kotatu,0,0
2023-01-11 13:27:10,#tama954 大吉先生早速献血に行かないと！。🤣,2496346962,niiaki40,0,0
2023-01-11 13:27:07,残念！本日は、はぴくら若松さんならず。#tama954,476448498,FriendNaginagi,0,0
2023-01-11 13:27:05,大吉大黒様 1万円日本銀行券 100枚あると助かりますwww  #tama954,3184887216,funndaramonndar,0,0
2023-01-11 13:26:36,スノーシューズで有名なのは「雪面の飛び魚」 #tama954 #水曜どうでしょう https://t.co/BrkVaKxHEa,109491434,mo10fu_3,5,0
2023-01-11 13:26:35,ここでウルトラマン(⌒-⌒; ) #tama954,862533539761344513,kb958559,0,0
2023-01-11 13:26:33,たまむすびニュース速報 #tama954 https://t.co/WUCD6nRdWj,222741807,monteblue_net2,3,0
2023-01-11 13:26:28,#tama954    いざ、鎌倉！！！馳せ参じるでござるwwww,108481807,tkphantom,0,0
2023-01-11 13:25:53,流石にウルトラマンのおひつは出てきませんな…。 このTLにはあるかも…？と思ったが…！ #tama954,122979729,tamaonbukittyo,0,0
2023-01-11 13:25:46,ひとりごと：♪大黒様〜大黒様〜2023、やったね♪＼(^o^ )／　 #tama954,155949926,n_kotatu,0,0
2023-01-11 13:25:32,@Tokyo_Ricks ミキサーやフードプロセッサー使わなくなる理由も「洗うのがめんどくさい」ってのが多いようだもんね。#tama954,1419510499398459397,KeLgzH26MaUAbDn,2,0
2023-01-11 13:25:20,その分いろいろ中で掠め取りそうなんだよなあ、UNIQLO。 #tama954,621275165,nekotowolf,1,0
2023-01-11 13:25:05,つーつーもー♪ と歌いたくなる良いお天気(^^)  #tama954,1251796897,hajime602,4,1
2023-01-11 13:25:02,声に出して言ってみたい響き「センブラボン」 #tama954,122320708,iki2Gyodajin,2,0
2023-01-11 13:25:02,もう値上げは勘弁  #tama954,1490362733635981313,has_bojji,2,0
2023-01-11 13:24:54,センブラボン #tama954,239296839,sekiraraeco,1,0
2023-01-11 13:24:50,来週のゲスト、凄い人って言ってるからパンサー向井さんではないことは確か。#tama954,476448498,FriendNaginagi,1,0
2023-01-11 13:24:46,早速タイムフリーで確認とはファクトチェック大事ですね👍✨ エナおばあちゃーーん！😂 #tama954 https://t.co/a2kTE06sZm,264737210,todddddddy,0,0
2023-01-11 13:24:45,そうか、今日は大吉大黒様だったか 何も考えて無かったよー 今年も他の方に福をお譲りします(*´ω｀*) #tama954,1389157969208627200,AmanoJack_0410,2,0
2023-01-11 13:24:34,ユニクロ初任給30万円！？ #tama954,239296839,sekiraraeco,1,0
2023-01-11 13:24:32,エキストラバージンオリーブオイラ(一人称  (｀・д・´)　b(´･∀･｀)d #tama954,3109201472,ssgtr1,0,0
2023-01-11 13:24:22,フライパンが丁度、傷んできたからココは大吉大黒様にお願いして…🙇‍♀️  #tama954,136619312,Ryoko108,4,0
2023-01-11 13:24:22,MEMO：ＴＢＳニュース、食用油ふたたび値上げへ、、、　 #tama954 #tbsradio #ss954,155949926,n_kotatu,0,0
2023-01-11 13:24:20,正社員の年収は引き上がるけどバイトやパートの収入はせいぜい微増なんでしょ？ #tama954,222741807,monteblue_net2,7,1
2023-01-11 13:24:11,忘れない人ではなく、忘れえぬ人。 #朗読のアナ　#ラジオ　#文化放送 #アナウンサー　#寺ちゃん　#読書 #tama954　#tera1134  #ss954 #病院　#介護　#ゴールデンラジオ  #リハビリ　#高田文夫 #ポッドキャスト　#ビバリーヒルズ https://t.co/Rr2fRzpFf7,1451573148466307072,hondesune,0,0
2023-01-11 13:24:06,30万でもまだ低いよなぁ。#tama954,3012746227,95orima211,0,0
2023-01-11 13:24:05,入社2年目で店長任されるのか　 #tama954,114987594,tanupocorin,3,2
2023-01-11 13:24:04,大吉先生の愚痴ツッコミが今年もキレキレで面白いな ＃tama954,69162065,hayama01,0,0
2023-01-11 13:24:02,今年はお願いします、大吉大黒様！ #tama954,3632462718,suusanja,0,0
2023-01-11 13:23:59,スーパー銭湯引き上げ(違う #数パーセント #tama954,862533539761344513,kb958559,1,0
2023-01-11 13:23:59,また値上げ… #tama954,1219966728525901824,lll_k_eight,0,0
2023-01-11 13:23:58,そこは「ウルトラマン  おひつ」でええやろ。 出てきたのコレだけどww #tama954 https://t.co/DgSsmCG6pJ,157298035,pikatti025,12,2
2023-01-11 13:23:54,よーし大黒様送ったぞ！　当たりますように…！！🙏🙏🙏  #tama954,52409392,rb_blue,2,0
2023-01-11 13:23:45,スーパー銭湯引き上げ #tama954,225339649,jinn_yoshitatu,1,0
2023-01-11 13:23:38,本日は大吉大黒様と #tama954,817553979026485248,mana_k2,0,0
2023-01-11 13:23:34,🙇ありがたや✨大黒大吉様✨🙇 #tama954,264737210,todddddddy,0,0
2023-01-11 13:23:31,なんか1月2日付けの月曜日ステッカーが届いた。録音だからメールは送っていないので、年賀状ハズれた人へのお年玉かな？#tama954,1419510499398459397,KeLgzH26MaUAbDn,3,0
2023-01-11 13:23:30,radikoで聞いたらやっぱりクリーミーナッツでした。 エナおばあちゃーん！（笑） #tama954 https://t.co/LckbxWEiQa,1898062195,otonosuzu,2,1
2023-01-11 13:23:27,何度でも値上げされちゃうな　 #tama954,114987594,tanupocorin,0,0
2023-01-11 13:23:17,片手鍋が欲しいんだけどメール送る気力なし_(:3 」∠)_ #tama954,821302089762492416,55_fukaeri_,0,0
2023-01-11 13:23:13,値上げニュースうるせぇ〜うるせぇ〜。#tama954,476448498,FriendNaginagi,1,0
2023-01-11 13:22:54,いくら仕事がいっぱいあっても収入が多くてもそういうところが二流。（まだ断ってもいないのに腐される山ちゃん…） #tama954 https://t.co/h66q35i16J,222741807,monteblue_net2,1,0
2023-01-11 13:22:46,伊沢大黒様  #tama954,1490362733635981313,has_bojji,1,0
2023-01-11 13:22:41,今日はノーてぃまむすびか、、残念と思ったら大黒大吉様があるからかな？！☺ #tama954,264737210,todddddddy,0,0
2023-01-11 13:22:37,三指ついて #tama954,821302089762492416,55_fukaeri_,0,0
2023-01-11 13:22:34,なまじ漆塗りだと気楽に洗えないから厄介もの扱いしそうな珠ちゃんw  #tama954,486528886,Tokyo_Ricks,3,0
2023-01-11 13:22:26,大吉ポストにミック・ジャガー呼ぼうよ！大吉先生とミック、どちらが色っぽいかたまちゃんに判定してもらおう！！ #tama954,2235617196,tarako_ja_nai,1,0
2023-01-11 13:22:13,大物ゲスト、大変結構ですけど、素直に瀧さん、帰っておいで・・・。 #tama954,828961162695880704,shi_much2,5,1
2023-01-11 13:22:11,冬の晴れた日は健やかな気持ちになりたいです。 #朗読のアナ　#ラジオ　#文化放送 #アナウンサー　#寺ちゃん　#読書 #tama954　#tera1134  #ss954 #病院　#介護　#ゴールデンラジオ  #リハビリ　#高田文夫 #ポッドキャスト　#ビバリーヒルズ https://t.co/9iV1Ifnrvn,1143161846892859393,areyonda,0,0
2023-01-11 13:22:06,円谷プロ　お櫃 ww #tama954,1258603016564862976,tetsu_door,0,0
2023-01-11 13:21:54,今日のメッセージテーマは『大吉大黒様降臨2023』 #tama954,1898062195,otonosuzu,3,1
2023-01-11 13:21:53,ははぁ〜🙇 大吉大黒さまぁ〜🙇‍♂️  #tama954,1555118356864241664,DanDan20913700,1,0
2023-01-11 13:21:44,252万…ところで伊沢大黒様は…(コラw) #tama954,143708483,submarine_mook,3,0
2023-01-11 13:21:34,来週はありそうな予感 #tama954,817553979026485248,mana_k2,0,1
2023-01-11 13:21:33,「円谷プロ　お櫃」 #tama954,58108432,masahiros27,3,0
2023-01-11 13:21:33,はい！みなさん、こうべを上げて〜！笑 #tama954,1553781551732707328,ponzu_zamurai,5,1
2023-01-11 13:21:23,今日のテーマ「大吉大黒様降臨2023」 #tama954,116622878,1xprox1,2,3
2023-01-11 13:21:20,ポール・マッカートニーがくるんだったらうれしいな。(う～ん)　#tama954,317670944,thundc,1,0
2023-01-11 13:21:19,誰だろ。予想としてはYOSHIKI #tama954,1484564701,machine0016,1,0
2023-01-11 13:21:13,口の中の水分が全部持っていかれて歌えなくなるに違いないww #tama954 https://t.co/pVMBSTA3Qq,264737210,todddddddy,1,0
2023-01-11 13:21:12,ひとりごと：大吉大黒様2023。頭が高い、、、と珠緒が言うスタイルw 　#tama954,155949926,n_kotatu,1,1
2023-01-11 13:21:05,今日のテーマ「大吉大黒様 降臨 2023」 大吉大黒様に買っていただきたいものを、理由と共に… （あんまり高いものはダメ）  #tama954,1251796897,hajime602,4,2
2023-01-11 13:21:00,元SMAPを超えるゲストなんて存在する？ #tama954,1293763792069771264,YUP14N,0,0
2023-01-11 13:21:00,今日のメッセージテーマ 「大吉大黒様降臨！２０２３」   #tama954,4431177912,popin954,1,0
2023-01-11 13:20:59,ぜっっっったいビビらないwww #tama954 https://t.co/8FxuLS4FJD,140404580,hitau,3,0
2023-01-11 13:20:58,@xxx 頭あげてください  ははぁー🙇‍♀️   #tama954,86561354,mackey1984,0,0
2023-01-11 13:20:55,だれ？悠里さんとか？（ないない）#tama954,476448498,FriendNaginagi,0,0
2023-01-11 13:20:54,えー じゃ伊沢大黒様もやってもらおう　  #tama954,139413398,raingirl33,0,0
2023-01-11 13:20:52,大吉大黒様って年に何回降臨するんだっけ?今年はこれで打ち止め? #tama954,116696183,nagaredamashii,1,0
2023-01-11 13:20:51,大吉先生「来週、お焚き上げに凄い人来るね。ビビるー」  ビビる大木さん？（笑） #違う #tama954,1898062195,otonosuzu,2,0
2023-01-11 13:20:42,大吉大黒様…何お願いしよう😀  #tama954,136619312,Ryoko108,1,0
2023-01-11 13:20:33,NOてぃまむすびかぁ #tama954,1258603016564862976,tetsu_door,1,0
2023-01-11 13:20:24,新規リスナーは分からないだろうな。#tama954,476448498,FriendNaginagi,0,0
2023-01-11 13:20:22,月一ぐらいでスペシャルゲスト来るなあ このコーナー #tama954,287100173,hitstw,0,0
2023-01-11 13:20:22,👉「行きつく先は「所得倍減」」（本文より）　🔴【岸田政権が少子化対策の財源に保険料値上げ画策 子育て世代にも負担なら事実上の「賃下げ」に(日刊ゲンダイDIGITAL)】 #Yahooニュース https://t.co/wpHPP1AEGb #tama954 #ss954 #アシタノカレッジ #TBSスタンバイ #おとなりさんラジオ #生活は踊る,2849915400,CurryCroquette,0,0
2023-01-11 13:20:21,来週？大物？大吉先生がびびる人？スペシャルウィークじゃん #tama954,116622878,1xprox1,1,0
2023-01-11 13:20:20,大吉大黒様の降臨で一応欲しい物考えてみるけど何も思い付かないしエピソード考えるのも面倒くさいから結局メールしないのよね  #tama954,109089816,teleglamsaru,1,0
2023-01-11 13:20:06,かつて赤坂にもCreepy Nutsがいた…そんな時代もありましたね  (´･ω･｀)(´ー｀) #tama954,3109201472,ssgtr1,2,0
2023-01-11 13:20:05,252万円〜へぇ〜！ #tama954,482992075,ayaaya077,1,0
2023-01-11 13:20:00,まろやかで優しそうなクリーミーナッツ😂ww #tama954 https://t.co/exs61bI1Nv,264737210,todddddddy,1,0
2023-01-11 13:19:57,大木さん？ｗｗ #tama954,39378021,zakuro396,0,0
2023-01-11 13:19:56,今日はノーてぃまむすび… #tama954,58108432,masahiros27,1,1
2023-01-11 13:19:48,またしても(ムダにw)豪華ゲストが来週？ #tama954,486528886,Tokyo_Ricks,0,0
2023-01-11 13:19:43,稲垣さんが来るのかな？ #tama954,239296839,sekiraraeco,2,0
2023-01-11 13:19:42,水曜日は松永さんの日だったもんねー #action954 遠い目… #tama954,839409662285918208,mac_row_cross_k,4,0
2023-01-11 13:19:41,さて もう300通くらいはメール届いてるのかな　  #tama954,139413398,raingirl33,1,0
2023-01-11 13:19:36,"今日はNo, てぃまむすび・・・。 #tama954",151906098,om4ti,0,0
2023-01-11 13:19:34,曲送りはハッキリCreepy Nutsと。 #tama954,1898062195,otonosuzu,0,0
2023-01-11 13:19:34,@xxx 来週の大吉ポスト どなたが！？   #tama954,86561354,mackey1984,0,0
2023-01-11 13:19:24,クリーピーナッツってこんな歌歌うんだ。 #tama954,239296839,sekiraraeco,0,0
2023-01-11 13:19:13,久米さん？  #tama954,582301255,onitang_saitama,0,0
2023-01-11 13:19:12,え、ということは来週のお焚き上げゲストって？ #tama954,32862003,maak4793,0,0
2023-01-11 13:19:11,え、来週のゲストビビる大木？ #tama954,1062244073119993856,Shinshin_kai,8,0
2023-01-11 13:19:11,また大吉ポストにスペッシャルゲストが #tama954,15902911,manabuk1,0,0
2023-01-11 13:19:06,え　誰誰？？？　 #tama954,114987594,tanupocorin,0,0
2023-01-11 13:19:02,え？また大物？？？ #tama954,482992075,ayaaya077,1,0
2023-01-11 13:19:01,あ、今日「よふかしのうた」が連載されてるサンデーの発売日だ。  #tama954,157298035,pikatti025,0,0
2023-01-11 13:18:57,1/9が誕生日だった珠ちゃんが今年 #大吉大黒様 から貰いたいもの 第一候補：ダテハキの「スノーブーツ」 第二候補：アサヒ軽金属の「真空スムージー」 第三候補：木曽さわらのお櫃（2合か3号） #tama954 https://t.co/A3Ytaa1XMS,109491434,mo10fu_3,2,0
2023-01-11 13:18:55,赤江さんと松永さん、もっとからんでほしかったなー #tama954,1518470407342358529,kotani_mi,0,1
