created_at,text,author_id,username,like_count,retweet_count
2022-01-19 14:05:24,関東では斜めにぶっ飛んだ憎めないサザエさん的な人気だけど、この違いはなんなんだろうか #tama954,881530074029215744,LA800325,0,0
2022-01-19 14:05:21,寛平師匠「大吉は昔から顔色悪いし、何をしてんねん」www  #tama954,3262736684,kawasister,2,0
2022-01-19 14:05:13,MEMO：間寛平さんと、赤江珠緒さんと、、、丹波篠山マラソンしんどかったとφ(^_^;)　 #tama954 #abc1008,155949926,n_kotatu,0,0
2022-01-19 14:05:04,華丸さんは健康そう #tama954,817553979026485248,mana_k2,1,0
2022-01-19 14:05:00,たまむすび芝生事件を春風亭一之輔師匠に落語にしてもらいたい #tama954,116622878,1xprox1,1,0
2022-01-19 14:04:59,顔色悪い男 #tama954,953481198361133056,mstradio1,0,0
2022-01-19 14:04:55,たしかに老若男女から愛されてた朝日放送時代のたまちゃん。なんならお嫁さんにしたい的な。 #tama954,755994537957351424,minchy_y,0,0
2022-01-19 14:04:48,赤江さん関西でそんなにすごい方だったとは… #tama954,1251796897,hajime602,3,0
2022-01-19 14:04:43,寛平師匠、さっそく芝生ネタをブチこむww #tama954 #間寛平,143708483,submarine_mook,1,0
2022-01-19 14:04:35,たまちゃん『師匠、あれは芝生よりも桜が見たくて』 #tama954,3262736684,kawasister,4,1
2022-01-19 14:04:22,寛平師匠、僕も関西ですけどウソ情報と思っていましたけど…w。 #tama954,98281508,kevinconasu,1,0
2022-01-19 14:04:21,寛平ちゃん、めちゃくちゃイケおじでした。  #tama954 https://t.co/GrcNyB4420,805997870360821760,bigsaltmisosoup,27,1
2022-01-19 14:04:17,珠ちゃんの記憶にもしっかり残る寛平ちゃん　ｳﾋﾊ  #tama954,114987594,tanupocorin,1,0
2022-01-19 14:04:16,😂  #tama954,1019024300869742592,Mio25589690,0,0
2022-01-19 14:04:09,凄みのある「刺すぞ」ww #tama954,111998871,blancnuage6509,0,0
2022-01-19 14:04:05,いまだに頻繁蒸し返されるアノ件  #tama954,128073526,yhishi,0,0
2022-01-19 14:04:03,大吉は顔色が悪いwwwwww #tama954,983856981977939969,Ggvg09,1,0
2022-01-19 14:03:59,蒸し返しキャスティング #tama954,2656520030,tiidddaaaa,0,0
2022-01-19 14:03:56,赤江さんは関西ではアイドル #tama954,817553979026485248,mana_k2,0,0
2022-01-19 14:03:55,関西では憧れの方だった赤江さんなのに、朝バードはクビ・・・(P瀧談) #tama954,828961162695880704,shi_much2,0,0
2022-01-19 14:03:54,記憶の角度が違う？ 芝生の上だと思ってたら 珠ちゃんは桜の木の下だったのか？ #tama954,1389157969208627200,AmanoJack_0410,0,0
2022-01-19 14:03:53,芝生案件をさくら案件に切り替えようとしている #tama954,940485525206548480,spongekamo,0,0
2022-01-19 14:03:51,「芝生ではなく桜の木の下です」 ジャーナ珠緒さんの訂正入りました。 #tama954,106921138,coga76,1,1
2022-01-19 14:03:51,週刊誌　芝生？桜の木の下？事件　　#tama954,732704484,rukahan,0,0
2022-01-19 14:03:51,ここまでしつこく芝生事件を追ってくれる人も珍しい。そうです、いろいろあった時期でした　 #tama954,95584469,yokkorasho,2,0
2022-01-19 14:03:45,珠ちゃんて関西では朝の顔でみんな見てたんだぞ、と間寛平師匠w #tama954,899647676043583490,nakakyou3,2,0
2022-01-19 14:03:45,ダメだ改めて芝生のあれこれがこんなことになって笑いが止まらんwww #tama954,116622878,1xprox1,0,0
2022-01-19 14:03:43,かんぺーさんのたまちゃん愛を感じるね＼(^o^)／        #tama954,788735707267203072,ssss_size,2,0
2022-01-19 14:03:41,瀧氏なんとかして #tama954,769581891150163968,hoshisandesuyo,1,0
2022-01-19 14:03:40,博多大吉　昔からお世話になっている間寛平に「あんまりお会いしたくない」「ちょっと疎遠」のワケ(スポニチアネックス) #Yahooニュース https://t.co/lfptdzR03L #tama954 ネットニュースになりました,3262736684,kawasister,1,0
2022-01-19 14:03:39,しかも、その顔色悪いオトコが今では公共放送の朝の顔だからな。#tama954,476448498,FriendNaginagi,0,0
2022-01-19 14:03:34,#tama954 まーだ蒸し返される芝生事件……。😅,2496346962,niiaki40,0,0
2022-01-19 14:03:32,？？？：みんなの珠ちゃんやないかい！＼(♯^o^)／　(^_^;)(^_^;)芝生で何をしてくれねんと　 #tama954,155949926,n_kotatu,0,0
2022-01-19 14:03:29,間寛平さんが来て、改めて芝生事件に触れざるを得なくなる、大吉先生。 #tama954 #tbsradio,309615176,_nohohon_,0,0
2022-01-19 14:03:28,それこそ寛平師匠の記憶の角度が違うのでは？w  #tama954,1210428970522443776,Noiseless_Noisy,0,0
2022-01-19 14:03:27,芝生事件を真に受け、大吉先生に「お前、たまちゃんに変な事をしたら刺すぞ」と言った事のある寛平さん（笑） #tama954,1898062195,otonosuzu,1,0
2022-01-19 14:03:26,関西の人はなにかしたと思っているw #tama954,1258603016564862976,tetsu_door,0,0
2022-01-19 14:03:23,芝生再び #tama954,2874416720,botchpro,0,0
2022-01-19 14:03:22,「何してくれてんねん」(´｀) #tama954,106921138,coga76,2,0
2022-01-19 14:03:20,本当だよ！赤江さん、朝の番組も夜の番組（ごきブラ）でも大人気だったよ。 #tama954,225746799,sohma_1115,1,1
2022-01-19 14:03:20,顔いろの件w #tama954,194441067,QPboo,0,0
2022-01-19 14:03:20,師匠、悪いのは瀧の野郎なんです！ 刺すならそちらをw #tama954,3316733503,SanjouTohru,0,0
2022-01-19 14:03:20,顔色悪い男が！（笑） #tama954,151906098,om4ti,0,0
2022-01-19 14:03:19,寛平さんによる珠ちゃん人気のバロメーターを信用していいのw  #tama954,114987594,tanupocorin,0,0
2022-01-19 14:03:15,芝生の件を引っ張る引っ張る…(￣▽￣;) #tama954,996687278134063104,radames92,0,0
2022-01-19 14:03:11,元はと言えば瀧が、悪い #tama954,91481104,akashiyataku,0,0
2022-01-19 14:03:09,赤江さん・大吉先生の芝生(桜の木の下)騒動、よくわかってなかった寛平さんは本気にw    #tama954,132537530,clie_zan,0,0
2022-01-19 14:03:08,#tama954  アメマバッジ売ってください。師匠。,2372218688,yamagata3308,1,0
2022-01-19 14:03:08,探偵さん、来た！ 「たまむすび聴取率調査にきました」・・・ではない。 #tama954,1288419203796496384,HQC_007,1,0
2022-01-19 14:03:05,改めて怒るのね寛平ちゃん #tama954,116622878,1xprox1,0,0
2022-01-19 14:02:59,何もしてないですwww #tama954,983856981977939969,Ggvg09,1,0
2022-01-19 14:02:54,桜の木の下で(芝生の上で #tama954,862533539761344513,kb958559,1,0
2022-01-19 14:02:54,関西では憧れの存在だったあかえさん #tama954,881530074029215744,LA800325,0,0
2022-01-19 14:02:47,ガチ説教ふたたびｗ #tama954,15902911,manabuk1,1,0
2022-01-19 14:02:47,関西ではみんなの憧れの珠ちゃん #tama954,983856981977939969,Ggvg09,0,0
2022-01-19 14:02:46,関西のアイドルを傷物にした大吉（寛平師匠脳内） #tama954,2613928734,walkyurie,2,0
2022-01-19 14:02:44,まだ許されてないww #tama954,769581891150163968,hoshisandesuyo,1,0
2022-01-19 14:02:41,軽ッ #tama954,817553979026485248,mana_k2,0,0
2022-01-19 14:02:40,怒るなら元凶のピー瀧さんをw #tama954,4431177912,popin954,1,0
2022-01-19 14:02:39,刺すぞ笑 #tama954,2222381767,April01st,0,0
2022-01-19 14:02:29,脅し笑  #tama954,1019024300869742592,Mio25589690,0,0
2022-01-19 14:02:26,赤江珠緒さんとなんかあったんなら刺すぞと大吉さんに言った間寛平さん。 #tama954,85960964,toofuya,1,0
2022-01-19 14:02:23,蒸し返される芝生事件w  #tama954,114987594,tanupocorin,3,0
2022-01-19 14:02:22,赤江さんは関西の姫なのかw #tama954,116696183,nagaredamashii,0,0
2022-01-19 14:02:22,寛平師匠ご登場！ 関西では赤江さんそんなに人気なのか  #tama954,4431177912,popin954,1,0
2022-01-19 14:02:19,寛平さんは大吉さんを半○しに #tama954,91481104,akashiyataku,0,0
2022-01-19 14:02:17,2時になりました\アヘー！/ #tama954,106921138,coga76,1,0
2022-01-19 14:02:15,関西の珠ちゃんを熱く語る（笑） #tama954,151906098,om4ti,2,0
2022-01-19 14:02:13,寛平さんのタイトルコール👏  #tama954,1019024300869742592,Mio25589690,0,0
2022-01-19 14:02:11,珠ちゃんは関西のアコガレ、「何ちゅーことしてくれてんねん」  #tama954,117979379,ParkBiker,0,0
2022-01-19 14:02:01,芝生事案を本気にしてた寛平ちゃんw  #tama954,486528886,Tokyo_Ricks,0,0
2022-01-19 14:02:01,MEMO：大吉ポスト、いったん預りま～すアヘェ＼(^o^)／　o(^o^ )(^_^;)間寛平さん登場　 #tama954 #tbsradio #radiko,155949926,n_kotatu,0,0
2022-01-19 14:01:57,たまちゃんのアクセント！#tama954,476448498,FriendNaginagi,0,0
2022-01-19 14:01:54,この後師匠だ #tama954,817553979026485248,mana_k2,0,0
2022-01-19 14:01:50,危うく寛平さんから刺されそうになってた大吉センセw  #tama954,114987594,tanupocorin,0,0
2022-01-19 14:01:45,寛平ちゃんだー！ #tama954,116622878,1xprox1,0,0
2022-01-19 14:01:42,@tos ♪芝生事件　蒸し返す   #tama954,86561354,mackey1984,0,0
2022-01-19 14:01:38,「刺すぞ」改めて聞いても草 #tama954,32862003,maak4793,0,0
2022-01-19 14:01:32,かんぺーちゃんｗｗ #tama954,15902911,manabuk1,0,0
2022-01-19 14:01:31,#tama954  さっきの鈴木アミーゴの歌声で  記憶が改竄されてる気がする。,2372218688,yamagata3308,0,0
2022-01-19 14:01:27,こわいｗｗｗ #tama954,894615215328841729,getty_ozi,0,0
2022-01-19 14:01:26,今日のメールテーマは #Ijuin の「空脳」コーナーの昔のメールをそのまま送ればいいんじゃないかい？  #tama954,144541494,manchot_neuf,1,0
2022-01-19 14:01:21,そういや養老孟司先生が「脳はウソをつく」とおっしゃっていたような…そしてこの記憶もウソなのかもしれない #tama954,116622878,1xprox1,0,0
2022-01-19 14:01:18,寛平さんの時間か 大吉先生が刺されませんように #tama954,1258603016564862976,tetsu_door,0,0
2022-01-19 14:01:16,自分「俺、もう終わっちゃったのかな…？」 ？？「はい。」 #tama954,996687278134063104,radames92,1,0
2022-01-19 14:01:06,キッズリターンの話から大吉先生の青春ほろ苦話。滲みる。#tama954,1037680342591623169,LceoYqys3c14InB,0,0
2022-01-19 14:01:03,間寛平さーん♪😊  #tama954,132537530,clie_zan,0,0
2022-01-19 14:01:03,もう来てたww アヘー！ #tama954,114987594,tanupocorin,0,0
2022-01-19 14:01:01,寛平ポスト #tama954,18374621,blackmadark,0,0
2022-01-19 14:00:59,かーんぺーさーん！ #tama954,2991031126,ayurah_radio,0,0
2022-01-19 14:00:48,きたきた〜w #tama954,194441067,QPboo,0,0
2022-01-19 14:00:46,遅れて聴き始めました #tama954,1389157969208627200,AmanoJack_0410,0,0
2022-01-19 14:00:45,遠い目ｗ #tama954,15902911,manabuk1,0,0
2022-01-19 14:00:39,#tama954  野良犬が熱い物語 https://t.co/9IsK8tKx1w,2372218688,yamagata3308,1,0
2022-01-19 14:00:21,人間の記憶なんて。。。簡単に書き変わってしまうもの💨俺の記憶もどっかしら変わってるんだろう。　#tama954,96297343,oitaro,0,0
2022-01-19 14:00:18,逆になんで来週、大吉先生は『生活は踊る』に行くんでしょうね（笑） #tama954 https://t.co/J07lcrUhUc,1898062195,otonosuzu,4,0
2022-01-19 14:00:16,朝帯の打ち合わせに来たのか寛平師匠。。  #tama954,95114793,gaylakite,0,0
2022-01-19 14:00:08,記憶の改ざんと記録の改ざん。 #tama954,194441067,QPboo,1,0
2022-01-19 14:00:06,犬なのは合ってる #tama954,817553979026485248,mana_k2,0,0
2022-01-19 14:00:03,で、その束縛は今はどうなったんだろね #tama954,881530074029215744,LA800325,0,0
2022-01-19 13:59:39,どちらの記憶が変わってるのかな？案件www #tama954,126421316,hsgwkyt,0,0
2022-01-19 13:59:38,@otonosuzu また召喚すると今度はタイムラインに乱れが……(笑) #tama954,1210428970522443776,Noiseless_Noisy,0,0
2022-01-19 13:59:35,大吉さんの青春の思い出を 「浅はかですねぇ〜」で片付ける赤江さんw #tama954,1288419203796496384,HQC_007,1,0
2022-01-19 13:59:24,意外と逆だったりして？ #tama954,114987594,tanupocorin,0,0
2022-01-19 13:59:18,ちゃんと距離詰めずに告白するのは若い人あるあるなのかねw  #tama954,52409392,rb_blue,0,0
2022-01-19 13:59:03,野犬やけん カチンとくるけん #tama954,82057322,ysdq,1,0
2022-01-19 13:58:55,あれ？来週スペシャルウィ(ｺﾞﾆｮｺﾞﾆｮ)なのになんで今週大吉ポストにゲスト呼ぶんだろう？#tama954,476448498,FriendNaginagi,0,0
2022-01-19 13:58:46,あさはかww　　　#tama954,788735707267203072,ssss_size,1,0
2022-01-19 13:58:44,電話してきたのがバイト先の吉岡くんと認識されてすらいなかった可能性も #tama954,188759798,tetumar,0,0
2022-01-19 13:58:39,こどもだから大きさも親と感覚が違うだろう。 #tama954,872361152621293568,Zerosp2017061,1,0
2022-01-19 13:58:34,野犬に追われる猫山氏。。 #tama954,95114793,gaylakite,0,0
2022-01-19 13:58:13,あさはかｗ #tama954,15902911,manabuk1,0,0
2022-01-19 13:58:07,今日のお題、私モテました、だっけw？ #tama954,98281508,kevinconasu,0,0
2022-01-19 13:57:51,コイバナにはグイグイ行く珠緒っち。#tama954,476448498,FriendNaginagi,0,0
2022-01-19 13:57:48,ねこやまさん🎉  #tama954🟢,863003082954645504,miiyan1182,0,0
2022-01-19 13:57:27,工業系の高校あるいは大学の女子は希少価値がすごいのでモテます #tama954,134622257,gaoqiaoren,1,0
2022-01-19 13:57:15,宮藤さんに言ってもしょうがないんですけど、K野さん？（笑） #tama954 https://t.co/AI34gpSHuP,1898062195,otonosuzu,1,0
2022-01-19 13:57:00,アベックって電波乗ったの聴いたの最近では関口宏くらいなもん。。  #tama954,95114793,gaylakite,0,0
2022-01-19 13:56:40,アベックもいい響きw #tama954,114987594,tanupocorin,0,0
2022-01-19 13:56:29,アベックw #tama954,194441067,QPboo,0,0
2022-01-19 13:56:15,(・益・ゞかい～の、待機中。 #tama954,1239408775808745473,BxaURcBA39FEdwA,1,0
2022-01-19 13:56:13,たまむすびはオープニングトークが盛り上がっていた影響で進行に遅れが出ておりましたが、現在時間通りの進行となっております  #tama954,1210428970522443776,Noiseless_Noisy,1,0
2022-01-19 13:55:28,キッズリターン大喜利が開催中w。 #tama954,98281508,kevinconasu,1,0
2022-01-19 13:55:10,らじおと終わっちゃ(やめとけ)　　　#tama954,476448498,FriendNaginagi,0,0
2022-01-19 13:55:09,楠葉さーん＼(^_^)／⤴️⤴️  #tama954,217849065,ggdat,0,0
2022-01-19 13:54:53,「明日もACTION！」 #tama954 #action954 https://t.co/2zTsgcgV8x,1898062195,otonosuzu,2,0
2022-01-19 13:54:32,ひとりごと：続けることが大切ですね、、、午後もどうぞ、ご安全にm( _ _)m　 #tama954 #あさぼらけ,155949926,n_kotatu,0,0
2022-01-19 13:54:31,キッズ・リターン、ほんと、いいよなぁ。 てか、このシーンの話ACTIONでも話してくれてたなぁ。#tama954,482992075,ayaaya077,0,0
2022-01-19 13:54:26,樹木の伐採作業終わっちゃったのかな。。  #tama954,95114793,gaylakite,0,0
2022-01-19 13:54:12,#tama954  ICカードの機能を コイツに組み込ませるの。 チャージしないと 『濁ってくる』の。 残高ゼロになると大変な事になるの。 どう？ B社さん、ビジネスチャンスやで！ https://t.co/SSzDARd1J3,2372218688,yamagata3308,6,0
2022-01-19 13:54:05,メールテーマむずかしすぎて、今日は諦めた。聞くに徹します #tama954,334053973,tomoka0707,0,0
2022-01-19 13:54:05,キッズ・リターンのセリフでみんな遊びすぎだ！ #tama954,14833302,nekomori774,1,0
2022-01-19 13:54:01,@FriendNaginagi 快適ネコ生活。お電話番号は、4147285、よいしな にゃ〜ご！ #tama954,988292528284745728,nanagen4,0,0
2022-01-19 13:53:59,豊富なデザインシンキングとかエンドユーザーの価値がうんたらかんたらとか言ってるデザイン会社ってうっとおしいデザインしそうだよね(やめなさい) #tama954,134622257,gaoqiaoren,2,0
2022-01-19 13:53:51,デイキャッチ終わっちゃったのかな。。 #tama954,95114793,gaylakite,0,0
2022-01-19 13:53:05,「TBSラジオ、終わっちゃうのかな」  「ああ、そうかもな」#tama954,2925837823,kame_gensan,0,0
2022-01-19 13:53:04,ドラリク、好きだったなー #tama954,334053973,tomoka0707,0,0
2022-01-19 13:53:02,ドライバーズリクエスト終わっちゃったのかな。。  #tama954,95114793,gaylakite,1,0
2022-01-19 13:53:00,新井ちゃんリターン #tama954,2572373359,12368Q,1,0
2022-01-19 13:52:48,キッズ・リターンの話を聞いただけで思い出して涙出そうになる #tama954,14490221,sntm0,0,0
2022-01-19 13:52:12,ごちペロさまでした！ かかっても軽症で済むなどと思わずにオミペロン株に気をつけましょう #tama954,2572373359,12368Q,3,0
2022-01-19 13:52:05,キラ⭐︎キラ終わっちゃったのかな。。  #tama954,95114793,gaylakite,2,0
2022-01-19 13:52:04,キッズ・リターンの話は  #action954 でもしてましたね… #tama954,3262736684,kawasister,3,0
2022-01-19 13:52:00,劇場版「らじおと」には合わないセリフ🥺(コラ) #tama954,257825175,oyamadakaigetsu,0,0
2022-01-19 13:51:57,kidsリターンのエンディングは、様々なアレンジを加えても名作！ #tama954 https://t.co/9Ts1KXyJ9G,3316733503,SanjouTohru,0,0
2022-01-19 13:51:45,今日のGIFT、金曜日に流したら玉さん「いーねっ！」と言っていたんじゃないかなw？ #tama954,98281508,kevinconasu,0,0
2022-01-19 13:51:41,このシーンか #tama954 https://t.co/Dj2tHKK21n,605946329,kin_ope,0,0
2022-01-19 13:51:09,「ギフト、始まったのかな？」  「バカやろう、まだ始まってもいねえよ」#tama954,2925837823,kame_gensan,0,0
2022-01-19 13:51:08,（結婚したのに）始まってない。←こんなコト言われたら。女の人は怒りがちなんじゃないの？ #tama954,94513415,PONSKE_ZZ,0,0
2022-01-19 13:51:07,めちゃくちゃほしいし、毎日元気に通勤できる☺️ #tama954  セーラームーンコラボの交通ICカード 全長18センチ、過去最大／台湾 - フォーカス台湾 https://t.co/mCAzLias4c,334053973,tomoka0707,3,0
2022-01-19 13:51:07,ゲストに来る人が話す内容の作品くらい見たらいいのにめちゃくちゃお忙しいのかな〜なら仕方ないね #tama954,881530074029215744,LA800325,2,0
2022-01-19 13:51:03,TBSラジオ終わっちゃったのかな #tama954,188759798,tetumar,4,0
2022-01-19 13:51:01,水曜日のメールテーマは難しい日が多い（今ごろ言うのか）  #tama954,1210428970522443776,Noiseless_Noisy,1,0
2022-01-19 13:50:52,らじおと終わっちゃうのかな。。 #tama954,95114793,gaylakite,1,0
2022-01-19 13:50:39,宮藤官九郎さんが語る『キッズ・リターン』  #tama954,839409662285918208,mac_row_cross_k,0,0
2022-01-19 13:50:31,またたまむすびでウルトラマン、須賀川の話題！！しかもさっき自分が読んだのと同じニュース！大吉先生は須賀川は第二の故郷だって😭そして明日のあさイチは特撮アーカイブセンターから中継！嬉しすぎ😭　#tama954,1077929522350063616,nami_ultrafm,6,2
2022-01-19 13:50:29,#tama954 https://t.co/6Ry6uyGl5y,91481104,akashiyataku,1,1
2022-01-19 13:50:27,棒状のICカードか。ふ菓子とかないかな。めっちゃリアルなの #tama954,194441067,QPboo,2,0
2022-01-19 13:50:22,夫婦になった時点で始まってるわ！ww #tama954,157298035,pikatti025,1,0
2022-01-19 13:50:21,馬場さんは予習はしないタイプの方なのね #tama954,1900128524,megalith_move,1,0
2022-01-19 13:50:11,KIDS RETURN https://t.co/MW9On4huDt @YouTubeより 久石譲で1番これが好き ジブリもいいけど #tama954,88142845,torino_hane,1,0
2022-01-19 13:50:06,「すべての映画がこれで終わってもいいんじゃないか」#tama954,112917199,barabara128,0,0
2022-01-19 13:49:45,@jasminchachacha ここまで届きましたしね。 #tama954 https://t.co/S5Iuf6jCBS,1898062195,otonosuzu,4,0
2022-01-19 13:49:38,JRのチャージ機なら、少し大きめのスマホでも大丈夫(⌒-⌒; ) #tama954  コンビニでチャージするのもタッチでOK(スティックを？,862533539761344513,kb958559,0,0
2022-01-19 13:49:36,汗くさワキッド #tama954,2572373359,12368Q,0,0
2022-01-19 13:49:25,「ドラリク、終わっちゃったのかな」 「バカやろう、まだ始まってねえよ（嘘）」 #tama954,2925837823,kame_gensan,2,0
2022-01-19 13:49:19,^o^100点👍  #tama954  #guchi954,488511628,Godd_Akaei,0,0
2022-01-19 13:49:18,キッズ・リターンの時の宮藤官九郎さんの事は覚えてない北野武監督… #tama954,996687278134063104,radames92,0,0
2022-01-19 13:49:14,ネタバレ。。 #tama954,95114793,gaylakite,0,0
2022-01-19 13:49:04,馬場さんにどんなラストシーンが聴いたらいいのに。。  #tama954,95114793,gaylakite,0,0
2022-01-19 13:48:49,お互いに TOO SHY SHY   #tama954,132537530,clie_zan,0,0
2022-01-19 13:48:48,セーラームーンと中華圏は何故か親和性が高くて、 中国では日本円で十万円オーバーの「月野うさぎ」カスタムスマホ出してましたから（ ﾟ∀ﾟ ） #tama954,1109944122326970368,mmantle3,2,0
2022-01-19 13:48:35,全然鬼滅の話をしない脚本家 #tama954,107645351,naoz0,2,0
2022-01-19 13:48:21,キッズ•リターンの話！高校生役の話よく聞く😊 #tama954,482992075,ayaaya077,0,0
2022-01-19 13:48:15,カツナメ #tama954,2572373359,12368Q,1,0
2022-01-19 13:47:59,いくらでも行けます（笑） #tama954 https://t.co/4EVPVvobXs,1898062195,otonosuzu,2,0
2022-01-19 13:47:46,キッズ・リターン見てないぽい馬場たん… #tama954,257825175,oyamadakaigetsu,0,0
2022-01-19 13:47:44,MEMO：馬場ノリGIFT、宮藤官九郎さん３日目。北野武映画『キッズ・リターン』、、、カツアゲされる役で出たと。　 #tama954 #tbsradio #guchi954,155949926,n_kotatu,0,1
2022-01-19 13:47:36,#tama954　ペロあげドリンク,128744633,pro1900,2,0
2022-01-19 13:47:24,今日もアクション（よしなさいw）！ #tama954 #action954,98281508,kevinconasu,3,0
2022-01-19 13:47:23,カツアゲされる役で出てたの？クドカン　#tama954,112917199,barabara128,0,0
2022-01-19 13:47:22,本当に先週のゲストとは全然違う作品の薦め方 #tama954,134622257,gaoqiaoren,0,0
2022-01-19 13:47:22,TBS以外のリスナーをほっぽらかした月曜日のギフト  #tama954,1210428970522443776,Noiseless_Noisy,0,0
2022-01-19 13:47:19,宮藤さん「カツアキする方の」 #カツアゲ #gift未来への贈り物 #tama954,1898062195,otonosuzu,0,0
2022-01-19 13:47:18,セーラー・クドカンさん🌝(違   #tama954,132537530,clie_zan,1,0
2022-01-19 13:47:17,みんな大好き『キッズ・リターン』。たしか、 #910anng でも話していたっけ。 #tama954,100993007,kotonosamurai,0,0
2022-01-19 13:47:14,あえて木の棒そっくりなICカードが欲しい。 小さい頃振り回してた木の棒みたいな簡素なやつ。 サラリーマンがカバンから木の棒出して電車乗ったら楽しいじゃん。  #tama954,4431177912,popin954,1,0
2022-01-19 13:47:09,こうゆう言い訳有りの変身ベルトとかブレスレット、出してくんねぇかなー。#tama954,3145074206,optnt1231,0,0
2022-01-19 13:46:56,舐められるんじゃねえぞ 舐めるんだよ #tama954,2572373359,12368Q,3,0
2022-01-19 13:46:55,このタイミングで聴き逃した冒頭をTFしようと思ったけど、宮藤さんだからこっち優先だ😊 #tama954,482992075,ayaaya077,2,0
2022-01-19 13:46:49,主人公にカツ揚げさせられる高校生（違） #tama954,157298035,pikatti025,2,0
2022-01-19 13:46:41,キッズリターン　#tama954,112917199,barabara128,0,0
2022-01-19 13:46:20,え？宮藤官九郎さんキッズ・リターンに出てたの？  #tama954,605946329,kin_ope,0,0
2022-01-19 13:46:17,#tama954  B社、 ビジネスチャンスやで！ 変身グッズにICカード組み込ませるの。 https://t.co/R5yBx8pxKg,2372218688,yamagata3308,2,0
2022-01-19 13:45:53,CM制作の価格表でいちばん安いやつ、CMソングはウチの会議室で社員歌わせるし、みたいな話してんだろうな。。  #tama954,95114793,gaylakite,1,0
2022-01-19 13:45:51,スティック型は非接触の観点から見ても良さそう　#tama954,84084569,cosmos2015,0,0
2022-01-19 13:45:44,「カードじゃないと、立体は邪魔だわ。」@嫁さん   #tama954,77460362,Kuukan,0,0
2022-01-19 13:45:42,＞実はこの怪獣が発案された背景には、番組制作予算が逼迫していたという事情がある。そこで、予算節約のために日活の『大巨獣ガッパ』の61式戦車の模型を流用して怪獣を作り出すという提案が成されたのである。  でしょうねえ #tama954  恐竜戦車とは【ピクシブ百科事典】 https://t.co/FnC2jmTbIO,103287325,Yu_Mori,6,0
