created_at,text,author_id,username,like_count,retweet_count
2022-01-19 14:21:41,餅ギャグの衝撃ww #tama954,899647676043583490,nakakyou3,0,0
2022-01-19 14:21:26,赤江さんが完全にABCに帰ってきた感じがまた良しw。 #tama954,98281508,kevinconasu,2,0
2022-01-19 14:21:25,大「お餅のギャグありますか？」 寛「べっちゃぁ〜」 珠「わっはっはっはっはww」 大「ないならないと・・・」 #tama954,1258603016564862976,tetsu_door,1,1
2022-01-19 14:21:20,【たまちゃんは関西の人】 いまの師匠のネタで大爆笑するたまちゃん。 わたしには少しばかり謎です。 #tama954,3037102160,shiro_kuma_mon,1,0
2022-01-19 14:21:19,大吉さん 故郷に錦飾ってるなあ。　#tama954,3184887216,funndaramonndar,0,0
2022-01-19 14:21:18,お餅のギャグ？#tama954,817553979026485248,mana_k2,0,0
2022-01-19 14:21:17,1歳年下が生島ヒロシ会長… #tama954 https://t.co/KIOm0aeo8I,257825175,oyamadakaigetsu,1,0
2022-01-19 14:21:12,今日のTBSは聞いても見えてこないw  #tama954,1210428970522443776,Noiseless_Noisy,2,0
2022-01-19 14:21:04,すべては「聞き流す」で完結。#tama954,953481198361133056,mstradio1,0,0
2022-01-19 14:21:02,寛平師匠のスベリギャグ「べちゃ〜」に赤江さん大爆笑 #tama954,116622878,1xprox1,3,1
2022-01-19 14:20:56,餅ギャグが生まれる瞬間に立ち会うことができたスタジオとリスナーであったww #tama954,157298035,pikatti025,4,1
2022-01-19 14:20:56,同じ餅をギャグにするなら膨らむ方を表現すれば良いのになんでべちゃ～なの？#tama954,476448498,FriendNaginagi,0,0
2022-01-19 14:20:47,珠ちゃんが楽しそうで何より #tama954,134622257,gaoqiaoren,1,0
2022-01-19 14:20:47,？？？：師匠、お餅のギャグは？( ^_^)(;^o^)o　o(^o^;)、、、べちゃぁ　 #tama954,155949926,n_kotatu,0,0
2022-01-19 14:20:36,最高www #tama954,769581891150163968,hoshisandesuyo,0,0
2022-01-19 14:20:27,♪お餅ライフ う～う～ 　もぉ～ がんばりぃすぎないでぇ～ #tama954,134622257,gaoqiaoren,1,0
2022-01-19 14:20:22,ひどいｗ #tama954,15902911,manabuk1,0,0
2022-01-19 14:20:20,新ギャグとともに🔥🔥🔥 #tama954,2991031126,ayurah_radio,0,0
2022-01-19 14:20:11,お餅の話でした #tama954,817553979026485248,mana_k2,0,0
2022-01-19 14:20:08,矢沢永吉とタメである。 #tama954,1425164517084856320,BVSoshiranuClub,0,0
2022-01-19 14:20:06,車の乗換えは壊れてからだと、予定外の出費だし、急ぐから十分に検討出来なくて、後悔する　#tama954,203359937,NRT0,1,0
2022-01-19 14:20:03,赤江さんが爆笑してくれたから良かったではないですか…(￣▽￣;) #tama954,996687278134063104,radames92,1,0
2022-01-19 14:20:02,たまむすびのおもち担当は竹山さんだから桃屋さんのお世話になろう #tama954,116622878,1xprox1,0,0
2022-01-19 14:19:59,角餅の入ったお供えを開封するのが、今の鏡開きらしい。 #tama954,129760958,VAV_VEEN_OCR,0,0
2022-01-19 14:19:43,♪「ジジイは、赤坂でギャグを言う。」 #tama954 #tbsradio #radiko,309615176,_nohohon_,0,0
2022-01-19 14:19:39,ぺっちゃ〜www   #tama954,132537530,clie_zan,0,0
2022-01-19 14:19:38,無茶振りと返しに草 #tama954,32862003,maak4793,0,0
2022-01-19 14:19:33,面白かったｗｗｗ #tama954,894615215328841729,getty_ozi,0,0
2022-01-19 14:19:31,即興で餅のギャグww  #tama954,114987594,tanupocorin,0,0
2022-01-19 14:19:24,お赤飯とおもちと白玉と    #tama954,132537530,clie_zan,1,0
2022-01-19 14:19:22,お汁粉にしたらいいよもう #tama954,116622878,1xprox1,0,0
2022-01-19 14:19:22,矢沢永吉さんと寛平師匠同じ年（笑）#tama954,785998809117569024,minori_n_ri_n,1,0
2022-01-19 14:19:11,もちは昔の方が旨かったよ #tama954,582301255,onitang_saitama,2,0
2022-01-19 14:18:54,青カビも良くないらしいが赤カビはもっとヤバい…(￣▽￣;) #tama954,996687278134063104,radames92,0,0
2022-01-19 14:18:54,のし餅は余るけど今はシングルパックだから長持ちするよね。#tama954,476448498,FriendNaginagi,0,0
2022-01-19 14:18:44,あれ？大吉先生刺されてないの？？ #tama954,157298035,pikatti025,3,0
2022-01-19 14:18:35,大吉センセ70歳でdon’t stop me nowを目指そう　#tama954,114987594,tanupocorin,0,0
2022-01-19 14:18:32,ドント・タッチ・ミー言うてしもうて頭おかしくなってる寛平さんww (自己申告) #tama954,1258603016564862976,tetsu_door,0,0
2022-01-19 14:18:28,あとでさんまさんに怒られるやつやw  #tama954,1210428970522443776,Noiseless_Noisy,0,0
2022-01-19 14:18:27,ひとりごと：師匠７２歳は尊敬を超えてコワイとw ５０年持つとwww　 #tama954,155949926,n_kotatu,0,0
2022-01-19 14:18:26,今年で73なの寛平さん！？ 50年作ったギャグが現役ww  #tama954,486528886,Tokyo_Ricks,0,0
2022-01-19 14:18:22,吉本の先輩がお越しになると大吉先生が気合い入ってしまって実家感がなくなることがわかる #tama954,3262736684,kawasister,0,0
2022-01-19 14:18:19,餅のカビの話！玉さんお外山さんも話してた！！ #tama954,482992075,ayaaya077,0,0
2022-01-19 14:18:17,そうだったw。寛平さんは適当な事言ってその都度さんまさんに説教される人だったw。 #tama954,98281508,kevinconasu,1,0
2022-01-19 14:18:13,正月のお餅って言ってるんだから余ったでええやろ。#tama954,476448498,FriendNaginagi,0,0
2022-01-19 14:18:10,寛平さん若い！！www #tama954,2991031126,ayurah_radio,0,0
2022-01-19 14:17:54,間寛平師匠と矢沢永吉さんは同い年。 #tama954,1239408775808745473,BxaURcBA39FEdwA,2,0
2022-01-19 14:17:41,どんとったっちみぃ～💕 寛平ちゃんかわえーww #tama954,106931842,15az,0,0
2022-01-19 14:17:41,いつもでさえ モヤモヤした解答したでないのに、更にモヤモヤした人入れても。  #tama954,138936817,106_masa,0,0
2022-01-19 14:17:39,夏の終わりには素麺がその立場に #tama954,1293763792069771264,YUP14N,0,0
2022-01-19 14:17:38,カビを包丁で削って食べてたなぁ #tama954,116622878,1xprox1,1,0
2022-01-19 14:17:33,寛平ちゃんサイコーだなっ🤣🤣🤣 #tama954,148747648,ty_ysy,0,0
2022-01-19 14:17:22,うちは農協の直売所でのし餅を買うから今でもしっかりカビますな。 #tama954,1171678088247144449,rfukai920,1,0
2022-01-19 14:17:12,この手の話ってまず自分の意図が伝わってないなら、モヤモヤする前に伝わるレベルで話さなきゃ 相手に”察し”を求めるのって自分が楽だからそうしてるだけなのに、当人たちは”気を遣ってる”つもりらしいし🧐  #tama954,1466195744948637697,kajiyasson,1,0
2022-01-19 14:17:12,中古車買って5年くらい乗ったら普通に10年は越えるよね？#tama954,476448498,FriendNaginagi,0,0
2022-01-19 14:17:09,通訳さんが必要(´w｀) #tama954,106921138,coga76,1,0
2022-01-19 14:17:05,お昼のラジオにももやっとしたリスナーさん⁇ #tama954,257825175,oyamadakaigetsu,0,0
2022-01-19 14:17:02,今なら『家にたっぷりあるお餅で』とかかなあ #tama954 昔は正月用に買ったのが残っているという認識が変わっていないんだね,157284779,furai06,1,0
2022-01-19 14:17:00,ドンとタッチみー #tama954,134622257,gaoqiaoren,1,0
2022-01-19 14:16:46,#tama954 https://t.co/VKcZWiINrM,3262736684,kawasister,3,0
2022-01-19 14:16:45,www #tama954,769581891150163968,hoshisandesuyo,0,0
2022-01-19 14:16:43,青カビ生えた餅は揚げて食ってたなあ。あれ美味かったなあ。。 #tama954,95114793,gaylakite,0,0
2022-01-19 14:16:32,初代NSXはミッションだったらいい値段するね。オートマは人気ないので意外と安い。 #tama954,98281508,kevinconasu,0,0
2022-01-19 14:16:25,寛平師匠がいるとなんか雰囲気締まっていいなｗ え、なんで？笑 #tama954,1219966728525901824,lll_k_eight,0,0
2022-01-19 14:16:20,MEMO：『余ったお餅』にモヤモヤ、、、寛平師匠どんとたっちみーφ？▽？;　 #tama954,155949926,n_kotatu,0,0
2022-01-19 14:16:13,ドントタッチミ〜〜〜w    #tama954,132537530,clie_zan,1,0
2022-01-19 14:16:12,餅って正月くらいしか食わんしな #tama954,18374621,blackmadark,0,0
2022-01-19 14:16:09,どう反応するのが正解なのw  #tama954,114987594,tanupocorin,0,0
2022-01-19 14:16:05,点検出すと あれも直せ これも直せ と言われる。   #tama954,178145389,KuniatsuSUN,0,0
2022-01-19 14:16:04,たまちゃん『11年、まだ乗りますよ』ペーパードライバーのたまちゃん…  #tama954,3262736684,kawasister,0,0
2022-01-19 14:16:00,スポンサー様への配慮ですねww　　#tama954,788735707267203072,ssss_size,1,0
2022-01-19 14:15:53,10年以上乗る人ってそんなに多くない気がするけどね #tama954,1258603016564862976,tetsu_door,0,0
2022-01-19 14:15:50,大阪のスタジオから家まで、一つも信号に引っ掛からなかった車か  #tama954,1210428970522443776,Noiseless_Noisy,0,0
2022-01-19 14:15:50,今 海外の日本車ブームと円安が相まって すごい値段がつくよ  #tama954,144413877,ttype911,0,0
2022-01-19 14:15:35,大吉さんCMの兼ね合いもあるのかw #tama954,116622878,1xprox1,0,0
2022-01-19 14:15:26,10〜20年位は今のご時世じゃザラですよ  #tama954,486528886,Tokyo_Ricks,0,0
2022-01-19 14:15:13,MEMO：１１年はまだ短いと寛平師匠、、、３～４年ごとの買い替えはと大吉先生φ(^_^;)　 #tama954,155949926,n_kotatu,1,0
2022-01-19 14:15:08,グーネットw #tama954,100993007,kotonosamurai,2,0
2022-01-19 14:15:08,「これからもずっと、思い出のある車でお世話になりますからよろしく」くらいでいいのでは #tama954,157284779,furai06,0,0
2022-01-19 14:15:06,#tama954 間 寛平 スカイライン 34GT-R  22年ワンオーナー 驚きの走行距離！ https://t.co/uH104qagmJ,103287325,Yu_Mori,1,1
2022-01-19 14:15:03,#tama954 このコーナー吉本率が高くなってきたな。,356698408,kenjimorita1,2,0
2022-01-19 14:15:00,大吉先生は車はともかく、タイヤはあそこからもらえるでしょ。 #tama954,129760958,VAV_VEEN_OCR,0,0
2022-01-19 14:14:57,買い換え勧める前に買い替えてしまった。 #tama954,178145389,KuniatsuSUN,0,0
2022-01-19 14:14:48,♪中古の中古の中古の #tama954,862533539761344513,kb958559,1,0
2022-01-19 14:14:48,買い替えの話はアンディさんに！ #tama954,1251796897,hajime602,4,0
2022-01-19 14:14:43,最初の車、10年くらい乗ったな  #tama954,4431177912,popin954,0,0
2022-01-19 14:14:42,頭文字Dみたいな車に乗ってるのね。 #tama954,150792778,caramelman100go,0,0
2022-01-19 14:14:38,NSXってオールアルミボディのやつ？ #tama954,144413877,ttype911,0,0
2022-01-19 14:14:38,こちらにも大吉様降臨。　#tama954,3184887216,funndaramonndar,0,0
2022-01-19 14:14:36,ホンダのNSXって、30年前は新車価格で700万くらいで売っていなかった？ #tama954,1239408775808745473,BxaURcBA39FEdwA,0,0
2022-01-19 14:14:36,赤江さんレヴェルのラジオスタァ大金持ちは車検ごとに新車買い替えじゃないのー?w #tama954,116696183,nagaredamashii,0,0
2022-01-19 14:14:32,「そんなコマーシャルやってるな」笑った #tama954,32862003,maak4793,0,0
2022-01-19 14:14:28,#tama954 間寛平の愛車「日産スカイライン 34GT-R」がすごい　手入れを20年以上絶やさない愛情とこだわり｜Real Sound｜リアルサウンド テック https://t.co/M7O3MgwCWD,103287325,Yu_Mori,3,1
2022-01-19 14:14:15,寛平師匠 日産GT-RのR34 と ホンダNSX初代 のオーナー！ #tama954,98281508,kevinconasu,0,1
2022-01-19 14:14:10,奥様に声かけたのはどう考えてもだまし買いだね。 #tama954,129760958,VAV_VEEN_OCR,1,0
2022-01-19 14:14:07,#tama954 間寛平さんの愛車 34GTR BRAYウインドプロテクション施工＆ GTR magazine | カーメイクアートプロのブログ https://t.co/TTdxVTXcU1 https://t.co/MzG8jkFBGl,103287325,Yu_Mori,3,2
2022-01-19 14:14:04,錦鯉のまさのりさんが、寛平師匠の芸風受け継ぎそうな気がしてきた  #tama954,1210428970522443776,Noiseless_Noisy,0,1
2022-01-19 14:14:03,なんか木曜日のいただきものを全てお持ち帰りなさった方もいたそうで。　#tama954,3184887216,funndaramonndar,0,0
2022-01-19 14:14:01,車で11年ならそんなに古くないような？#tama954,476448498,FriendNaginagi,0,0
2022-01-19 14:13:56,プレゼント魔のアタスはつい何かしらプレゼントしちゃいます が お返しは望んでませーん 喜んでくれたらそれでいーけれど貰うとお返し考えるよねぇ と毎回反省しながら進歩ないわ・・・ #tama954,106931842,15az,0,0
2022-01-19 14:13:53,プレゼント好き属性から言わせてもらうと、お返しはいらないっす　あげてる時点で完結してるので　#tama954,203359937,NRT0,1,0
2022-01-19 14:13:37,R34とNSXじゃ太刀打ちできぬ。   #tama954,178145389,KuniatsuSUN,1,0
2022-01-19 14:13:33,NSXは今もあるのでは？ なかった時期もあったと思うが #tama954,1258603016564862976,tetsu_door,0,0
2022-01-19 14:13:24,なんかこのコーナーっていつもビンボ臭いよね。心身ともに。そりゃ車屋なんだから買いませんかは言うだろ #tama954,111561084,TeraBeppin,0,0
2022-01-19 14:13:12,R34とNSX… #tama954,90928277,sakaki_fff,0,0
2022-01-19 14:13:09,寛平師匠、どうした？#tama954,817553979026485248,mana_k2,0,0
2022-01-19 14:13:04,走行距離の少ないR34のGT-RにNSX！ 下手すると何千万とかなるんじゃない？ #tama954,1251796897,hajime602,2,0
2022-01-19 14:13:01,ディスカバリーチャンネルの名車再生に出したらめっちゃ喜ばれそう　#tama954,476448498,FriendNaginagi,0,0
2022-01-19 14:13:00,わかる！ 接客良し悪しがあって 最悪バカにされてる気分になるときも #tama954,1474432410,fukushima_akita,0,0
2022-01-19 14:13:00,え、なんでそこで「脳みそばーん！」なんすかw。 #tama954,98281508,kevinconasu,0,0
2022-01-19 14:12:54,脳味噌BURRN〜♫ #tama954,106921138,coga76,1,0
2022-01-19 14:12:53,34のRは本当にすごい #tama954,857775204533063680,atsu11nu,0,0
2022-01-19 14:12:52,のーみそ、ばーん。 #tama954,309615176,_nohohon_,0,0
2022-01-19 14:12:50,赤江さん大吉先生寛平さん🤯こんにちは！ ＼のーみーそばーーん！！／ #tama954,264737210,todddddddy,0,0
2022-01-19 14:12:50,師匠、自由やなあ  #tama954,1210428970522443776,Noiseless_Noisy,0,0
2022-01-19 14:12:48,34のGTR乗ってるのか⤴️スゲーな💨💨💨NSXとか。。。懐かしいね🎵　#tama954,96297343,oitaro,0,0
2022-01-19 14:12:46,師匠、走り屋？ #tama954,116622878,1xprox1,0,0
2022-01-19 14:12:44,ＮＳＸとＧＴ－Ｒ、お宝もいいとこですよね。  #tama954,117979379,ParkBiker,2,0
2022-01-19 14:12:41,寛平さんwww  #tama954,178145389,KuniatsuSUN,0,0
2022-01-19 14:12:40,オレなんかあのたまむすびタオル買ってもうた。５本も。　#tama954,3184887216,funndaramonndar,0,0
2022-01-19 14:12:36,錆ついたりしてない？　 #tama954,114987594,tanupocorin,0,0
2022-01-19 14:12:32,NSXって擦ったら治せんのかな。。  #tama954,95114793,gaylakite,0,0
2022-01-19 14:12:30,新車すすめられるの嫌なら10年落ちの車をディーラーに点検出さない方がいいんじゃないの #tama954,2925837823,kame_gensan,0,0
2022-01-19 14:12:25,Q&amp;Aが脳みそバーンw #tama954,116622878,1xprox1,0,0
2022-01-19 14:12:21,のうみそばあああああああんｗｗｗｗ #tama954,940485525206548480,spongekamo,0,0
2022-01-19 14:12:13,寛平さんR34だよね めちゃカッコイイ #tama954,1389157969208627200,AmanoJack_0410,1,0
2022-01-19 14:12:04,面白い話を考える方が大変だよね #tama954,817553979026485248,mana_k2,0,0
2022-01-19 14:12:00,NSX! #tama954,15902911,manabuk1,1,0
2022-01-19 14:12:00,脳みそburn #tama954,18374621,blackmadark,1,0
2022-01-19 14:11:54,MEMO：クルマもやもや、、、で、寛平ちゃん脳みそパーーーン？　 #tama954 #garageheros,155949926,n_kotatu,1,1
2022-01-19 14:11:52,R34乗ってるのか、NSXも所有してるのか #tama954,116696183,nagaredamashii,0,0
2022-01-19 14:11:48,師匠、そんないい車持ってるのか！ #tama954,32862003,maak4793,0,0
2022-01-19 14:11:44,営業さんかしたら買い替えてもらった方が売上になるものね  #tama954,4431177912,popin954,0,0
2022-01-19 14:11:31,赤江さん、わかっていないでしょ。 #tama954,129760958,VAV_VEEN_OCR,0,0
2022-01-19 14:11:22,別に安全の為に勧めてくれただけやん。#tama954,476448498,FriendNaginagi,0,0
2022-01-19 14:11:10,のーみそバーーーン！！！#tama954,114987594,tanupocorin,1,0
2022-01-19 14:10:58,ファンへのお返しは大吉先生の笑顔で(*^^*)      #tama954,788735707267203072,ssss_size,0,0
2022-01-19 14:10:55,『虫返されるあのパンツ』 #tama954 https://t.co/js5ZPAJLF7,1898062195,otonosuzu,1,0
2022-01-19 14:10:50,さすがたまちゃん、更に上げてくるｗ #tama954,5079811,vivivi,0,0
2022-01-19 14:10:49,そして！大吉ポストに間寛平さんが生登場！大吉さんへの怒りの真相とは…？😂#tama954 https://t.co/T1rWfKrpuH,1354102175928963072,tamamusubi_tbsr,205,19
2022-01-19 14:10:35,小咄ｗｗｗ #tama954,15902911,manabuk1,0,0
2022-01-19 14:10:31,私は続けますね＝自分がやりたいだけ宣言、だからお礼言うだけでお返しはいらないよね #tama954,126902986,dadaraki,0,0
2022-01-19 14:10:23,「面白いエピソードを一つ」そんなん赤江さんくらいしか出来んわ！ #tama954,32862003,maak4793,1,0
2022-01-19 14:10:21,プレゼントのお返しにおもしろ小噺を一つ、よりプレッシャーが高まるw #tama954,116696183,nagaredamashii,1,0
2022-01-19 14:10:18,バナナマンとサンドはプレゼントあげ合ってるのが #tama954,91481104,akashiyataku,1,0
2022-01-19 14:10:07,そうそう、遠回しじゃなくちゃんと言えばいいのにね  #tama954,4431177912,popin954,0,0
2022-01-19 14:09:53,おばちゃん「持って帰れ！、持って帰れ！」 寛平さん「嫌や！、嫌や！」 #tama954,1258603016564862976,tetsu_door,0,0
2022-01-19 14:09:53,こうやってラジオで寛平さんの声聴くともうおじいちゃんだな #tama954,2925837823,kame_gensan,1,0
2022-01-19 14:09:45,伊集院光の後継を寛平さんてのはどうか。 #tama954,85960964,toofuya,0,0
2022-01-19 14:09:39,ターボババアという妖怪を思い出した #tama954,116622878,1xprox1,0,0
2022-01-19 14:09:39,サンテレビガールズになる赤江さん、 自転車を漕いどる赤江さん。  朝の顔になる赤江さん。 高校野球の実況をする赤江さん。 どれも赤江さんではある。 #tama954 #tbsradio #radiko,309615176,_nohohon_,0,0
2022-01-19 14:09:27,でも声だけだと余り寛平師匠って分かりにくいな。#tama954,476448498,FriendNaginagi,0,0
2022-01-19 14:09:21,#tama954 https://t.co/PmPGfeNGtw https://t.co/dnbyUAZNIK,1898062195,otonosuzu,2,0
2022-01-19 14:09:12,なんかすごい自分勝手に感じる〜別にいいじゃない 。嫌ならお返ししなきゃいい。でも人間関係狭めそう。#tama954,1110045269045870595,egokoro0701,0,0
2022-01-19 14:09:07,妖怪じゃん #tama954,881530074029215744,LA800325,0,0
2022-01-19 14:09:03,ひとりごと：オバチャンも強ぇ強ぇw　 #tama954,155949926,n_kotatu,0,0
2022-01-19 14:08:54,華丸大吉さんをデビューの若い頃からみていた地元福岡民からすれば、 あの子供の頃から土曜日午後放送してた吉本新喜劇の間寛平さんと大吉先生が 2022年の今、共演されてあるのは なかなか感慨深いものがある。  #tama954,1296595267295121408,Pt8Mrsv,2,0
2022-01-19 14:08:30,なら毎度お返しは商品券にでもしたら？ ｢毎回色々頂いても何を贈ったらいいか分からないから｣って言ってさ～って😅 #tama954,89435613,swa_anzu,1,0
2022-01-19 14:08:28,田舎あるあるww #tama954,18374621,blackmadark,0,0
2022-01-19 14:08:27,関西弁をこんなに聞く時間になるとは。 さすが寛平さん。 #tama954,1288419203796496384,HQC_007,0,0
2022-01-19 14:08:19,@toofuya ！？　ABC時代を全く知らないので不思議な気持ちですw  #tama954,4431177912,popin954,1,0
2022-01-19 14:08:08,他人が漬けた紫の何かは食べられないな #tama954,983856981977939969,Ggvg09,1,0
2022-01-19 14:08:08,寛平さん、わかります笑 手づくりは少し苦手かなぁ #tama954,2222381767,April01st,0,0
2022-01-19 14:08:02,メッセージテーマは「#記憶の角度が違います」。あーれー？確かこんな思い出だったんだけどな…。そんなエピソードぜひ教えてください！#tama954,1354102175928963072,tamamusubi_tbsr,76,7
2022-01-19 14:07:59,芝生事件にしても何にしても、この番組、何か起きたら最後には 「瀧さんが悪い！」 って結論で収まるのホント好き #tama954,151902095,angle45_ss,5,0
2022-01-19 14:07:58,篠山マラソンは寒すぎるし、山を走るコースだし、制限時間5時間ちょいだから相当自信ないと走れないんだよなぁ。  グーグルで篠山マラソンと入力したら厳しいと出るくらいだしw。 #tama954,98281508,kevinconasu,0,0
2022-01-19 14:07:55,またこの人から貰いたいと思った時だけお返ししてる… #tama954,769581891150163968,hoshisandesuyo,0,0
2022-01-19 14:07:50,また散髪屋のおばちゃんw #tama954,114987594,tanupocorin,0,0
2022-01-19 14:07:41,#tama954 わかる！！&gt;プレゼントいらない、負担 ○○がめっちゃ買い物好きで、あらゆるものをくれる。1度、しっかりいらない旨を伝えた。減ったけどまだくれる。何もかもいらない。,180788522,Lansei,0,0
2022-01-19 14:07:31,春には執行猶予も明けるかと #tama954 https://t.co/JmqNUVtcza,116622878,1xprox1,2,0
2022-01-19 14:07:20,あれ嫌やでｗｗｗ #tama954,15902911,manabuk1,0,0
2022-01-19 14:07:13,#tama954 https://t.co/3E5GIHA0Dp,1210428970522443776,Noiseless_Noisy,4,1
2022-01-19 14:07:09,家が狭くて置き場無いからせめて消え物にして〜て言いなよ #tama954,881530074029215744,LA800325,0,0
2022-01-19 14:07:07,ひとりごと：師匠w　ストレートが強いですwww　 #tama954,155949926,n_kotatu,0,0
2022-01-19 14:06:57,関東ではポンコツ呼ばわり、関西では大スターなたまお #tama954,128073526,yhishi,0,0
2022-01-19 14:06:56,若いお嬢さんが毎朝番組に出るってことは記憶でアイドルとかお姫様とか妹とかそんな感じになる説 #tama954,14833302,nekomori774,0,0
2022-01-19 14:06:54,プレゼントをもらうのが嫌なの？ こちらがお返しを考えるのが嫌なの？  #tama954,4431177912,popin954,0,0
2022-01-19 14:06:52,華丸は太陽の似合う色しとるのに不健康そうなこいつが何しとんねん と寛平兄さんからのお叱りの芝生話ww 大吉ポスト一端あずかりまーすタイトルコール聞けた💕ウンバラバア💕 こんにちは(*´∇｀*) #tama954,106931842,15az,0,0
2022-01-19 14:06:47,珠ちゃんは関西では人気物🤭  #tama954,143866706,nabet2010,0,0
2022-01-19 14:06:29,でも正直ABC時代の赤江さんってちょっとドンクサイよね。#tama954　今の方が断然美人。,476448498,FriendNaginagi,0,0
2022-01-19 14:06:26,たぶん今、 宇宙でいちばん強いです。 ウルトラ兄弟を除いて。  👉 https://t.co/UC9SiCqVNh  #tama954 #たまむすび #赤江珠緒  #博多大吉 https://t.co/Utuy7M1jsL,1354102175928963072,tamamusubi_tbsr,504,62
2022-01-19 14:06:20,断っても好きでやってるんだからお返しせずに勝手にやらせておくしかないのでは　 #tama954,114987594,tanupocorin,0,0
2022-01-19 14:06:13,ゆるやかな大吉カッター　　#tama954,788735707267203072,ssss_size,0,0
2022-01-19 14:06:12,MEMO：リスナーさんモヤモヤ、、、プレゼントのモヤモヤ？　 #tama954,155949926,n_kotatu,0,0
2022-01-19 14:06:02,瀧さんの件も約3年前の話になるのか…。 #tama954,140826240,yagami0415,2,0
2022-01-19 14:06:01,探偵さんだから寛平師匠大丈夫です #tama954,116622878,1xprox1,0,0
2022-01-19 14:05:56,赤江さん「師匠、一個だけ。芝生ではなく、『桜の樹の下で』をいれて欲しい」 寛平さん「ボーッとして」  師匠、それはメインエンジン（P瀧さん）を失った話をしてたから（笑） #tama954,1898062195,otonosuzu,0,0
2022-01-19 14:05:56,そう言えば、ナイトスクープ顧問出演計画が…(今や顧問不在に)  #tama954,1267318034227539970,JsrWViR2LkHOtH7,0,0
2022-01-19 14:05:55,あたりまえっ！w #tama954 https://t.co/yI7yLM3XNe,85960964,toofuya,1,0
2022-01-19 14:05:43,関西で「たまっぷ」は、SMAPに匹敵する？ #tama954,988292528284745728,nanagen4,0,0
2022-01-19 14:05:25,あったかい #tama954,857775204533063680,atsu11nu,0,0
