created_at,text,author_id,username,like_count,retweet_count
2023-01-10 16:49:36,はーい🙋‍♀️お二人の雰囲気好きです 吾郎店長＆吉田店員さんさようなら〜 #THETRAD,312068715,56aya56,1,0
2023-01-10 16:49:35,連休明けの仕事はヘビーだったんだけど、吾郎さんの声を聞いて癒された～！また来週～！ #THETRAD,188788444,4ever5map,1,0
2023-01-10 16:49:30,マンボウさん 私も先週ですごく好きになりました ありがとうございます😆 #THETRAD,2476425162,1118okko,3,1
2023-01-10 16:49:28,今年最後ってー🤣🤣🤣 #THETRAD,171270262,1756riko1756,0,0
2023-01-10 16:49:27,そうだよ！  リスナーーーーーーー   #THETRAD,826784736001482752,gappi05chan24,2,0
2023-01-10 16:49:24,なんで部屋の電気を暗くしたかったの😄 抱くためか🤣 #THETRAD #スカロケ　#クロストーク #稲垣吾郎　#吉田明世 #マンボウやしろ　#浜崎美保,912643581105414144,244056chizuSUKI,3,0
2023-01-10 16:49:12,明日はまさかの「今年最後のTHE TRAD」と吉田店員さん。いや、それは困ります。  #THETRAD,1203328464314462209,ochapyonpyon,5,0
2023-01-10 16:49:09,今年最後ぉ〜？🤣🤣🤣  #THETRAD #TOKYOFM #稲垣吾郎 #吉田明世,105611997,kumako_momoyama,1,0
2023-01-10 16:49:07,吉田さんとだと安心して任せられ店長もどっしりとで落ち着いて聞けました　いいコンビ♡♡ #thetrad📻#tokyofm,334414357,DaIskInaIrO,0,0
2023-01-10 16:49:05,本部長 浜崎秘書さん 先週はありがとうございました 部屋を暗くしてやりたかった吾郎店長😂 優しく抱かれるところでしたと本部長😂😂😂  #THETRAD #稲垣吾郎  #吉田明世 #TOKYOFM #スカロケ クロストーク,708341562967633920,Rumi_1756,8,0
2023-01-10 16:49:00,本部長と距離が縮んだ吾郎店長(*≧∀≦*)  電気を消しましょうー  #THETRAD #稲垣吾郎,1386694922292457473,560am405,14,0
2023-01-10 16:48:59,ビックリした！！ 今年最後って🤣  #THETRAD #稲垣吾郎 #吉田明世,2948100434,risarei56,30,0
2023-01-10 16:48:57,もう年末な吉田店員w #THETRAD,1930740240,tomokon0914,1,0
2023-01-10 16:48:51,どーいう状況？！😂 吉田さん動揺してるじゃんw  #THETRAD,137626071,piyoitter,1,0
2023-01-10 16:48:50,４人揃ってのクロストーク楽しい🥰 #THETRAD #スカロケ,919468519044952065,OY0QdVky7tR0DLa,6,0
2023-01-10 16:48:50,暗くなっちゃう😂 #THETRAD,4301510538,piroshiki0512,0,0
2023-01-10 16:48:49,今日も楽しいクロストーク🤣 #THETRAD #スカロケ,1039300484069085184,mako_nakamako,2,0
2023-01-10 16:48:47,クロストーク！  またやしろ本部長や浜崎秘書とご一緒してほしいー  #スカロケ #THETRAD,1330355475414536192,heeko_1208,5,0
2023-01-10 16:48:42,今年最後のトラッドww #THETRAD,3304092385,gurukunchax,0,0
2023-01-10 16:48:40,え、もう今年最後？🤭  #THETRAD #稲垣吾郎,816420153265000449,ohirune_nerune,2,0
2023-01-10 16:48:40,今年最後の？？？😆 #THETRAD,1080419512640360448,piggoro56,6,0
2023-01-10 16:48:32,今年最後のトラッド？！？！明日が？！？！  #THETRAD,1375422747711447041,tBh7hgx4lh44Add,0,0
2023-01-10 16:48:29,吉田さんは眠いかどうかすぐ吾郎店長にバレちゃうそう。  #稲垣吾郎 #吉田明世 #tokyofm #THETRAD,107745163,loveGdolce,4,0
2023-01-10 16:48:28,部屋の電気暗くして、とかさ…  #THETRAD,1051364971081158656,yubedesu,0,0
2023-01-10 16:48:10,吉田さんwww #THETRAD #稲垣吾郎 #吉田明世,1538719267956269056,nkimkk_smaplove,2,0
2023-01-10 16:48:09,まさかの今年最後wwwww  #THETRAD,72770536,Nao_D,1,0
2023-01-10 16:48:07,明世〜！🤣🤣🤣 #THETRAD,1431569717228019724,smart3901,3,0
2023-01-10 16:47:59,何を言ってるの吉田さん🤣 #THETRAD,99950563,shikki_k,2,0
2023-01-10 16:47:58,今年終わるじゃねーかwwww   #THETRAD,1199252360091930625,custom__77,2,0
2023-01-10 16:47:58,吾郎店長が変なこと言うから吉田店員間違えちゃった  #THETRAD #TOKYOFM #稲垣吾郎　#吉田明世,926227463104950272,hai_5603e,8,0
2023-01-10 16:47:51,びっくりしました(笑) #THETRAD,152660581,mayumiyoshioka,0,0
2023-01-10 16:47:50,スカロケとクロストーク。和気あいあいと楽しそう♪先週のやしろ本部長とのトークとても良かったですよ。 #THETRAD #稲垣吾郎 #吉田明世 #tokyofm,106451763,G832,0,0
2023-01-10 16:47:49,牡蠣を剥くナイフも持っている生牡蠣好きな吾郎店長。 一度アタって牡蠣がダメになったひと、で思い浮かべちゃうひと、もう一人いるなぁ…… #THETRAD,391052686,Rio_Grande_5656,0,0
2023-01-10 16:47:48,あははは😅 本部長と吾郎店長の距離感😁 #THETRAD,718783506596245504,SayangMrs,0,0
2023-01-10 16:47:47,今年最後！！ #THETRAD,1046734214048051207,funori_wa_kaiso,1,0
2023-01-10 16:47:44,吉田さん！ 今日が今年最初で、明日は今年最後、ってwww  #THETRAD #稲垣吾郎 #吉田明世,130866183,haruhi5smap,0,0
2023-01-10 16:47:36,吾郎店長の前でやしこが出てしまった本部長。😁  #THETRAD #スカロケ,1064016833202741248,activethelife,5,0
2023-01-10 16:47:32,部屋の電気🤣 #スカロケ #THETRAD,99950563,shikki_k,3,0
2023-01-10 16:47:27,吾郎店長とマンボウやしろさん、先週の放送で距離が縮まったそうです😉なかなか深いお話しされてましたよね😊  #THETRAD #稲垣吾郎,919487215310290949,ebidoriaj812,0,0
2023-01-10 16:47:16,スカロケとクロストーク♪ 吾郎「本部長来てるのかな？」 本部長「いまーす」 吾郎「先週はありがとうございました。浜崎さんも」 #THETRAD #稲垣吾郎 #吉田明世 #tokyofm,105929459,yuinago,10,1
2023-01-10 16:47:10,スタッフの罠にハマった？吉田さん？ 初おいおい案件w  #THETRAD #稲垣吾郎　#吉田明世　#tokyofm,119603899,ryoku56,4,0
2023-01-10 16:47:06,吉田さん🤣🤣🤣 #THETRAD #稲垣吾郎 #吉田明世,786508238514638848,junneko56,4,0
2023-01-10 16:47:00,3週間の入院で いろいろ記憶も体力も 取り戻すのが大変なばーちゃんですが、 味には敏感だった笑い話、 読んでいただけて幸いです😅 #THETRAD,1080419512640360448,piggoro56,47,2
2023-01-10 16:46:50,#THETRAD 今年一年、長かった,15186031,katsuwo,0,0
2023-01-10 16:46:48,今年最後って・・・びっくりした～！よしださ～ん！ #THETRAD,188788444,4ever5map,1,0
2023-01-10 16:46:46,今年最後…？😆（笑） #THETRAD,101080324,kana_akiyama,0,0
2023-01-10 16:46:42,「違いが分かる大人」 ・伊達巻に使う卵の違い ・ビスケット お菓子の味の違い ・生牡蠣の美味しさが分かるように  吉田さん生牡蠣 苦手なのですね‥私もです。 #THETRAD #稲垣吾郎 #吉田明世,911256434108645376,Poodle56Toy,1,0
2023-01-10 16:46:41,「いつか克服しよう！美味しいから」 吾郎さんにそんな事言われたら、生牡蠣苦手だけど、食べてみたくなっちゃいます。 #THETRAD #稲垣吾郎 #吉田明世 #tokyofm,911984865549049862,ako565655,7,1
2023-01-10 16:46:41,去年の台本が紛れてた まだ今年は終わっちゃヤダ🤣🤣   #THETRAD,331993844,Shimy43,2,0
2023-01-10 16:46:31,今年最後のTRADです♪ だったらどうしようwww 始まったばかり😂  #THETRAD,826784736001482752,gappi05chan24,6,1
2023-01-10 16:46:28,吾郎さんは牡蠣が大好きで自分で剥いて食べるぐらい 吉田さんは牡蠣にあたっちゃった事あるのね💦 あれはすごく苦しいみたいだよね💦 #THETRAD #TOKYOFM #稲垣吾郎　#吉田明世,912643581105414144,244056chizuSUKI,1,1
2023-01-10 16:46:26,夜7時頃THE TRAD日誌B面トーク配信予定！  #稲垣吾郎 #吉田明世 #tokyofm #THETRAD,107745163,loveGdolce,2,0
2023-01-10 16:46:22,生牡蠣好きで自分の専用ナイフも持っている吾郎店長。大好きなんだな #稲垣吾郎 #THETRAD,912713818333003778,choco2L,7,1
2023-01-10 16:46:21,仲が深まった寂しさw📻暗くしちゃって〜 #thetrad #tokyofm 今年もう最後wwww吉田さん、ファイト,334414357,DaIskInaIrO,0,0
2023-01-10 16:46:19,今年始まったばっかなのに今年最後って(^^; #THETRAD,911950669577281538,aktbucco5656,1,0
2023-01-10 16:46:16,月火稲垣吾郎さん、#THETRAD 違いがわかるにサッカーアトランタ五輪など注目される前から中田英寿の新しい考え方、2010年W杯で騒がれる前本田圭佑の(2部とはいえオランダリーグでの爆発的な得点力)勢い、20歳以下代表から目立つ！と思った南野拓実は英国の強豪リヴァプールに森保JAPANで一番得点10番と,321375331,nao_z_des,0,0
2023-01-10 16:46:08,クロストーク♪先週のわちゃわちゃ最高でした！ 本部長、浜崎さん、ありがとうございました。  #THETRAD #稲垣吾郎　#吉田明世　#tokyofm #スカロケ,119603899,ryoku56,8,0
2023-01-10 16:46:08,吾郎さん、お昼下がりの番組ですよ😤笑 #THETRAD,736688663644377088,hiroe_sma,0,0
2023-01-10 16:45:59,吉田さん？？😆😆 #THETRAD,312068715,56aya56,0,0
2023-01-10 16:45:54,#スカロケ　とクロストーク！  「本部長、来てるのかな？」 来てます！ 「先週はありがとうございました」 こうして掛け合いも楽しいんですけど、先週あれだけ長くお話ししたのでちょっと寂しい、と本部長。   #稲垣吾郎 #吉田明世 #tokyofm #THETRAD,107745163,loveGdolce,3,0
2023-01-10 16:45:48,どういう展開w   #THETRAD,826784736001482752,gappi05chan24,1,0
2023-01-10 16:45:44,本部長との距離が縮まった吾郎店長 電気暗くしてあげて🤣🤣   #THETRAD #稲垣吾郎 #吉田明世,331993844,Shimy43,5,0
2023-01-10 16:45:37,大好きだなぁ生牡蠣 #THETRAD https://t.co/ckGA0Qd1xO,99950563,shikki_k,2,0
2023-01-10 16:45:09,@THETRAD_TFM スマスナ＠CaYOHpmyfl6e5ou 1月10日 本日のお客様は、ピアニストの石井琢磨さんにご来店頂きました！ 最後は、昨年リリースされましたアルバム『TANZ』よりこちらの曲を聴きながらお別れです！ ありがとうございました！ またのお越しをお待ちしております！ ＃THETRAD＃TOKYOFM,929876001638641664,caYOHPmYfl6e5ou,4,0
2023-01-10 16:45:07,モンポウの曲の生演奏 そしてピカデリーが聴けて良かった😊 吾郎さんYouTubeよく見てらっしゃる🤭 次は吾郎さんリクエストの雨だれお願いします🤭 トークも楽しかったです🎶 ありがとうございました。 #稲垣吾郎 #石井琢磨 #THETRAD,1399852881289760770,hanapiyo0812,3,0
2023-01-10 16:45:06,ブランド玉子やはり生で、ごはんにのせてTKGで食べると歴然と味が違うけど、火を入れちゃうと見分けるの難しいかも #THETRAD,391052686,Rio_Grande_5656,0,0
2023-01-10 16:44:49,ひと冬で2回もあたったのに毎年やめられないくらい好きな生牡蠣 #THETRAD #TOKYOFM #稲垣吾郎 #吉田明世,1159621612053774338,salyu56,1,0
2023-01-10 16:44:47,ﾓｳｲｲﾃﾞｼｮ、に笑う。でも一回当たると克服は難しいですよね #THETRAD https://t.co/smNsGByamI,99950563,shikki_k,1,0
2023-01-10 16:44:45,吾郎店長はかきが大好きですよね。今までもたびたびかきのことを話されていました。私もかきは大好き。でも、子供の頃は食べられなかったなぁ〜😝😟  #THETRAD #稲垣吾郎,919487215310290949,ebidoriaj812,0,0
2023-01-10 16:44:43,殻付き牡蠣専用のナイフを持っている店長。 格別よね、生牡蠣。 私も大当たりしたことあるけど（そりゃーもう大騒ぎよ）牡蠣からは離れられなかった。  #THETRAD #稲垣吾郎　#吉田明世　#tokyofm,119603899,ryoku56,6,0
2023-01-10 16:44:37,吾郎さんちには牡蠣の殻むきまであるのね #THETRAD　#TOKYOFM #稲垣吾郎　#吉田明世,926227463104950272,hai_5603e,7,1
2023-01-10 16:44:25,違いのわかる大人。生牡蠣の美味しさ。 吾郎「僕はオイスター大好きだから。買ってきて、自分で殻を開けるの持ってるから」 #THETRAD #稲垣吾郎 #吉田明世 #tokyofm,105929459,yuinago,4,0
2023-01-10 16:44:18,メープルシロップの味がするクッキー。 You、それは🇨🇦名物 メープルシロップクッキーだよ 🤣🤣🤣  #稲垣吾郎 #THETRAD,154074992,goromichiyo,6,1
2023-01-10 16:44:04,パッケージが似ていると限定版でも気づかなかったりするのわかる #稲垣吾郎 #吉田明世 #THETRAD,912713818333003778,choco2L,6,0
2023-01-10 16:43:41,生牡蠣、食べてみたいと思いつつ、ちょっと恐い😂 美味しいんだろうなー   #THETRAD #稲垣吾郎 #吉田明世,331993844,Shimy43,0,0
2023-01-10 16:43:30,違いのわかる大人の味覚^⁠_⁠^  吾郎店長の好物である生牡蠣も大好きだったのに、私はある日突然アレルギーになってしまい残念です😭  #THETRAD #TOKYOFM  #稲垣吾郎 #吉田明世,911872711365877760,gorochi5656,0,0
2023-01-10 16:43:22,伊達巻の食べ比べ 格付けみたいと吾郎店長 私も今年の年末やってみようかな?? 4本も作るんだから😁  #THETRAD #稲垣吾郎  #吉田明世 #TOKYOFM,708341562967633920,Rumi_1756,4,0
2023-01-10 16:43:16,好きなお菓子の味は覚えているよね。 #THETRAD #稲垣吾郎 #吉田明世 #TOKYOFM,106451763,G832,0,0
2023-01-10 16:42:41,違いのわかる大人。いつもと違うビスケットは限定味だった。 #THETRAD #稲垣吾郎 #吉田明世 #tokyofm,105929459,yuinago,2,0
2023-01-10 16:42:18,石井さんの『クラシックを身近に』というコンセプトはとても素敵 ピカデリー💕 明るいお声で沢山お話くださってとても楽しかったです  #石井琢磨 さんありがとうございました  #THETRAD  #稲垣吾郎 #吉田明世,886977101391208448,shuka333,10,4
2023-01-10 16:42:14,あらやっぱり。吾郎店長カフ下げ忘れで変な声を入れちゃったからLINE WORKSのCMやり直し〜(^_^;) #tokyofm #THETRAD,109782550,milazuke,0,0
2023-01-10 16:42:05,伊達巻くらべ、というか利き卵。盛り上がったでしょうね♪ #THETRAD #稲垣吾郎 #吉田明世 #TOKYOFM,106451763,G832,0,0
2023-01-10 16:42:02,石井琢磨さん 生演奏と楽しいお話を ありがとうございました。  47都道府県ツアーの完走をお祈りいたします。 #THETRAD #稲垣吾郎 #吉田明世,911256434108645376,Poodle56Toy,3,1
2023-01-10 16:41:57,反田さんと石井さんのYouTubeも⁉️ チェックしてみます☺️  石井琢磨さんの雨だれ🎹 楽しみ🎵  #THETRAD,914730967075450880,iymsmap,1,0
2023-01-10 16:41:53,違いのわかる大人。妹さんが特価卵とお高い卵で伊達巻を作ってくれて食べ比べ。 #THETRAD #稲垣吾郎 #吉田明世 #tokyofm,105929459,yuinago,1,0
2023-01-10 16:41:46,面白い企画。 #THETRAD　#TOKYOFM #稲垣吾郎　#吉田明世,926227463104950272,hai_5603e,0,0
2023-01-10 16:41:40,生牡蠣 「僕は大好き。産地の違うの買ってきて。剥くのもある」  #稲垣吾郎 #吉田明世 #tokyofm #THETRAD,107745163,loveGdolce,6,1
2023-01-10 16:41:39,生ガキたべたいなあΨ( 'ч' ☆) #THETRAD,911950669577281538,aktbucco5656,1,0
2023-01-10 16:41:36,@THETRAD_TFM スマスナ＠CaYOHpmyfl6e5ou 1月10日 石井琢磨さんの出演も決定している、 #TOKYOFM の長寿番組 ありがとうございました！ ＃THETRAD＃TOKYOFM,929876001638641664,caYOHPmYfl6e5ou,0,0
2023-01-10 16:41:33,本当だ ピカデリーって、身近で耳にする曲ですね #THETRAD,2476425162,1118okko,3,1
2023-01-10 16:41:02,石井琢磨さん、お話はとても楽しくて素敵な生演奏も聴かせていただき、とても贅沢な時間でした ありがとうございました✨ #THETRAD #TOKYOFM #石井琢磨 さん #稲垣吾郎　#吉田明世,912643581105414144,244056chizuSUKI,1,0
2023-01-10 16:40:47,#石井琢磨 さん ありがとうございました✨  #THETRAD #稲垣吾郎 #吉田明世,2948100434,risarei56,14,0
2023-01-10 16:40:46,♪ピカデリー / 石井琢磨 #THETRAD #稲垣吾郎 #吉田明世 #tokyofm #石井琢磨,105929459,yuinago,0,0
2023-01-10 16:40:42,リクエストする吾郎さんw 雨だれ #THETRAD #稲垣吾郎 #吉田明世,911768250911883264,UHG5YDVgtMsK14L,4,0
2023-01-10 16:40:29,楽しい時間をありがとうございました☺🙏♡  #THETRAD #石井琢磨 ｻﾝ,1237602972550365184,hedgehog0118,29,0
2023-01-10 16:40:08,次回はショパンの雨だれをリクエストした吾郎店長。石井さんまたぜひお願いします。 #石井琢磨 #稲垣吾郎 #吉田明世 #THETRAD,912713818333003778,choco2L,9,1
2023-01-10 16:40:06,石井琢磨 さんありがとうございました。 また是非遊びに来て下さい。 待っています。  #THETRAD   #石井琢磨   #稲垣吾郎   #吉田明世   #TOKYOFM,303651608,myumama7,2,0
2023-01-10 16:40:00,【ENTERTAINMENT MAP】 本日は、ピアニストの石井琢磨さんにご来店頂きました！ 最後は、昨年リリースされましたアルバム『TANZ』よりこちらの曲を聴きながらお別れです！🎹  ピカデリー / 石井琢磨  #THETRAD #TOKYOFM,1177547375037968387,THETRAD_TFM,351,78
2023-01-10 16:39:58,本日のお話に出てきた曲や演奏動画はここから聴けます。 海外ストリートピアノの動画がオススメでっせ🎵🎹  TAKU-音 TV たくおん https://t.co/UvSiJHc0rT  #THETRAD #tokyofm #石井琢磨,1224303064326144000,mochie2020,3,3
2023-01-10 16:39:57,曲を聴きながらお別れ。 石井さん、素敵なお話と生演奏をありがとうございました！ またいらしてくださいね♪その時は雨だれを☔️ #THETRAD #稲垣吾郎 #吉田明世 #tokyofm #石井琢磨,105929459,yuinago,6,3
2023-01-10 16:39:54,面白い（笑）伊達巻きあて #THETRAD,312068715,56aya56,2,0
2023-01-10 16:39:43,雨だれはショパンを好きになったきっかけの曲。石井さんにいつか弾いてほしいと吾郎さん。是非叶いますように。素敵な生演奏ありがとうございました！ #THETRAD #稲垣吾郎 #吉田明世 #tokyofm,911984865549049862,ako565655,18,4
2023-01-10 16:39:37,石井さん、ありがとうございました。またのご来店お待ちしています。 #石井琢磨 #THETRAD,1039300484069085184,mako_nakamako,0,0
2023-01-10 16:39:32,ショパンの雨だれを今度弾いて欲しいとおねだり吾郎💖 わかりましたぁ〜。 と可愛く了承、石井琢磨さん☺️  #稲垣吾郎 #THETRAD,154074992,goromichiyo,15,3
2023-01-10 16:39:25,商店街の端っこにこんなレコードショップが あったらすごく楽しい🎼☺️ どこかで聞いたピアノの曲だ🎹ピカデリー？ #THETRAD,919468519044952065,OY0QdVky7tR0DLa,3,0
2023-01-10 16:39:11,石井琢磨さんありがとうございました✨️ 生演奏素敵✨ トークも楽しかったです🎶  #THETRAD #稲垣吾郎  #吉田明世 #TOKYOFM,708341562967633920,Rumi_1756,8,0
2023-01-10 16:39:10,#石井琢磨 さん、素敵な生演奏をありがとうございました😄✨   #THETRAD,331993844,Shimy43,0,0
2023-01-10 16:39:06,雨だれ、次のお約束できましたねー✨ 吾郎店長 #THETRAD,1330355475414536192,heeko_1208,4,0
2023-01-10 16:38:54,石井琢磨さん生演奏素敵でした ありがとうございました✨ #THETRAD,1686865830,amelie405_yoko,0,0
2023-01-10 16:38:52,お馴染みのピカデリー！ #THETRAD,1930740240,tomokon0914,0,0
2023-01-10 16:38:52,石井琢磨さん、ありがとうございました✨ 次回、今から楽しみです。#THETRAD,152660581,mayumiyoshioka,0,0
2023-01-10 16:38:46,石井琢磨さん 醸し出される柔和な感じが魅力的♬ 他の曲も聴いてみたくなりました  また是非ともご来店ください！ #THETRAD,978068049604431872,yukinosita_cabb,3,0
2023-01-10 16:38:32,大好きなショパン・雨だれを弾いてもらう約束する吾郎さん♪ #THETRAD #稲垣吾郎 #吉田明世 #tokyofm #石井琢磨,105929459,yuinago,7,0
2023-01-10 16:38:24,「JET STREAM 55th LIVE」ご出演  音楽の世界旅行 いろいろな国を感じて頂けたらと。 #THETRAD #稲垣吾郎 #吉田明世,911256434108645376,Poodle56Toy,1,0
2023-01-10 16:38:24,吾郎さんは大好きな『雨だれ』をリクエスト。 いつか弾いてください、と。  #稲垣吾郎 #吉田明世 #tokyofm #THETRAD #石井琢磨   素敵な演奏をありがとうございました！ ぜひまた来てください！,107745163,loveGdolce,8,3
2023-01-10 16:38:23,月火稲垣吾郎さん #THETRAD グラミー賞か、Beyonce BREAK MY SOULあれ良かった前歌ってみた動画撮ったことあれど、今そのアニメ加工のアプリMacで撮れん、も iPhoneで AppleMusic Singで歌ってみました〜と LESSERAFIMの、Anti-Fragileも〜車内で録り、FBには出しました、韓国語わからないのは鼻歌で https://t.co/NSoz8HnCrS,321375331,nao_z_des,0,0
2023-01-10 16:38:22,遅れてながら聴き📻 #THETRAD,4761800215,smapper2016,0,0
2023-01-10 16:38:04,ピカデリー (マーチ) https://t.co/tMWWYH2yKc @YouTubeより   #稲垣吾郎 #吉田明世 #tokyofm #THETRAD #石井琢磨,107745163,loveGdolce,4,4
2023-01-10 16:37:40,そういえば吾郎さん、反田恭平さんがピアノの師匠になってくださるお話どうなりました？またとないお話、是非進めてくださいな🎶 #THETRAD #稲垣吾郎 #SMAP #新しい地図 #TOKYOFM,874456597874876417,y5smap,3,0
2023-01-10 16:37:35,うさぎの格好しているけど亀でやっていきたいなと…石井琢磨さん 大切な事のような気がするな #THETRAD #稲垣吾郎 #吉田明世,911768250911883264,UHG5YDVgtMsK14L,5,0
2023-01-10 16:37:18,#THETRAD #稲垣吾郎 #フレデリコモンポウ ベートーヴェン https://t.co/QtjgIq5Z7l,1324891885928763392,1756nakama_smap,0,0
2023-01-10 16:37:08,カフェピアノシリーズ🎹 観たことありました！ 生演奏 素敵でしたー♡ #THETRAD #石井琢磨 さん,1220900703859666944,kanakichi_405,1,0
2023-01-10 16:37:04,新婚ほやほやの反田恭平さん😆 お似合いのお2人で嬉しくなってしまいました🎶   #THETRAD,331993844,Shimy43,5,0
2023-01-10 16:36:59,今年は都道府県周りたい。 けど、ウィーンには帰りたくなるので 行ったり来たり。 石井琢磨さん今年は大忙し‼️  #稲垣吾郎 #THETRAD,154074992,goromichiyo,14,2
2023-01-10 16:36:57,｢渦潮見ながらいいなぁって｣ #THETRAD,1930740240,tomokon0914,0,0
2023-01-10 16:36:52,47都道府県ツアー🦔🚩 和歌山公演行きました♪ #THETRAD,2162903124,Cherie_k1128,8,0
2023-01-10 16:36:21,大好きなショパンの雨だれをリクエストする吾郎店長^⁠_⁠^  #石井琢磨 さんご来店ありがとうございました🎹  #THETRAD #TOKYOFM  #稲垣吾郎 #吉田明世,911872711365877760,gorochi5656,3,0
2023-01-10 16:36:11,アルバム #Tanz 聞きたい  #THETRAD,1330355475414536192,heeko_1208,0,0
2023-01-10 16:36:10,雨だれはショパンを好きになったきっかけとなった曲。 いつか石井さんに弾いてほしいと店長おねだり。  #THETRAD #稲垣吾郎　#吉田明世　#tokyofm,119603899,ryoku56,9,2
2023-01-10 16:36:05,ごろさんゲストの方の作品や上げてらっしゃる動画も細やかにチェックしている。おすすめ神社への参拝もだけど、番組とそこでの出会いを大切にしているのが伝わる #THETRAD,391052686,Rio_Grande_5656,19,6
2023-01-10 16:35:40,曲はまだ決まってないのね #THETRAD #稲垣吾郎 #吉田明世,911768250911883264,UHG5YDVgtMsK14L,1,0
2023-01-10 16:35:39,今年は47都道府県コンサートをされる石井さん♪合間にウィーンに帰ると。 #THETRAD #稲垣吾郎 #吉田明世 #tokyofm #石井琢磨,105929459,yuinago,8,0
2023-01-10 16:35:27,【反田恭平】男子２人でおうちモンブラン会 inウィーン【前編】【おしゃべり散歩】 https://t.co/3vWn7y4LNs @YouTubeより   #稲垣吾郎 #吉田明世 #tokyofm #THETRAD #石井琢磨,107745163,loveGdolce,12,5
2023-01-10 16:35:25,火の鳥♪ 日本全国都道府県ツアー、素敵ですね。   #THETRAD   #稲垣吾郎　 #石井琢磨,119397623,gmoircohi,1,0
2023-01-10 16:34:50,また生演奏でモンポウ聴きたいな♪ YouTube動画はこちらです↓ https://t.co/ysC4Sti9TD  #THETRAD #石井琢磨,2162903124,Cherie_k1128,13,0
2023-01-10 16:34:42,@THETRAD_TFM 素敵✨✨✨ #石井琢磨 さん✨ 生演奏なんて♪♯✨ 初めて聴いたという印象です。 ありがとうございます。 モンポウ♪♯✨  アルバム #TANZ 📀にも収録！  へぇ、吾郎店長は 坂本龍一さんに モンポウ お勧め頂いてたんですね  #THETRAD #稲垣吾郎 さん✨ #吉田明世 さん✨,842337317058617346,chacha681111,4,0
2023-01-10 16:34:36,モンポウ！知らなかったです！ 生演奏、とても素敵ですね  石井琢磨さんが子供の頃に聴いてピアニストになろうと思った ショパンの木枯らしのエチュードも聴きたかったです  #THETRAD #稲垣吾郎 #吉田明世,744415470044930048,ara13767,4,0
